"No.","Time","Source","Destination","Protocol","Length","Info"
"1","0.000000000","fe80::22b0:1ff:fe33:6ba2","ff02::1:ffd1:ceda","ICMPv6","86","Neighbor Solicitation for 2a0d:6fc2:4940:600:b02e:364c:bbd1:ceda from 20:b0:01:33:6b:a2"
"2","0.238098172","192.168.1.196","192.168.1.1","DNS","92","Standard query 0x40c0 HTTPS moodlearn.ariel.ac.il OPT"
"3","0.250067612","192.168.1.1","192.168.1.196","DNS","178","Standard query response 0x40c0 HTTPS moodlearn.ariel.ac.il SOA drppa-infogm.bezeqint.co.il OPT"
"4","0.251341945","192.168.1.196","192.168.1.1","DNS","92","Standard query 0xf9d0 AAAA moodlearn.ariel.ac.il OPT"
"5","0.255491321","192.168.1.1","192.168.1.196","DNS","92","Standard query response 0xf9d0 AAAA moodlearn.ariel.ac.il OPT"
"6","0.256657249","192.168.1.196","34.96.118.58","TCP","74","34824  >  443 [SYN] Seq=0 Win=64240 Len=0 MSS=1460 SACK_PERM TSval=4134288185 TSecr=0 WS=128"
"7","0.260136210","34.96.118.58","192.168.1.196","TCP","74","443  >  34824 [SYN, ACK] Seq=0 Ack=1 Win=65535 Len=0 MSS=1412 SACK_PERM TSval=2960358714 TSecr=4134288185 WS=256"
"8","0.260165051","192.168.1.196","34.96.118.58","TCP","66","34824  >  443 [ACK] Seq=1 Ack=1 Win=64256 Len=0 TSval=4134288188 TSecr=2960358714"
"9","0.260911058","192.168.1.196","34.96.118.58","TLSv1.3","1968","Client Hello (SNI=moodlearn.ariel.ac.il)"
"10","0.264559247","34.96.118.58","192.168.1.196","TCP","66","443  >  34824 [ACK] Seq=1 Ack=1401 Win=267520 Len=0 TSval=2960358718 TSecr=4134288189"
"11","0.264559579","34.96.118.58","192.168.1.196","TCP","66","443  >  34824 [ACK] Seq=1 Ack=1903 Win=267264 Len=0 TSval=2960358718 TSecr=4134288189"
"12","0.270336707","34.96.118.58","192.168.1.196","TLSv1.3","2114","Server Hello, Change Cipher Spec"
"13","0.270336991","34.96.118.58","192.168.1.196","TCP","2114","443  >  34824 [PSH, ACK] Seq=2049 Ack=1903 Win=267264 Len=2048 TSval=2960358721 TSecr=4134288189 [TCP PDU reassembled in 14]"
"14","0.270337022","34.96.118.58","192.168.1.196","TLSv1.3","601","Application Data"
"15","0.270369854","192.168.1.196","34.96.118.58","TCP","66","34824  >  443 [ACK] Seq=1903 Ack=2049 Win=63488 Len=0 TSval=4134288198 TSecr=2960358721"
"16","0.270458668","192.168.1.196","34.96.118.58","TCP","66","34824  >  443 [ACK] Seq=1903 Ack=4097 Win=61568 Len=0 TSval=4134288198 TSecr=2960358721"
"17","0.270486238","192.168.1.196","34.96.118.58","TCP","66","34824  >  443 [ACK] Seq=1903 Ack=4632 Win=61056 Len=0 TSval=4134288198 TSecr=2960358721"
"18","0.278288443","192.168.1.196","192.168.1.1","DNS","87","Standard query 0x78d1 A ocsp.godaddy.com OPT"
"19","0.278771181","192.168.1.196","192.168.1.1","DNS","87","Standard query 0x6358 AAAA ocsp.godaddy.com OPT"
"20","0.281609642","192.168.1.1","192.168.1.196","DNS","208","Standard query response 0x78d1 A ocsp.godaddy.com CNAME ocsp.godaddy.com.akadns.net A 192.124.249.23 A 192.124.249.36 A 192.124.249.22 A 192.124.249.24 A 192.124.249.41 OPT"
"21","0.281819824","192.168.1.1","192.168.1.196","DNS","204","Standard query response 0x6358 AAAA ocsp.godaddy.com CNAME ocsp.godaddy.com.akadns.net SOA internal.akadns.net OPT"
"22","0.282305808","192.168.1.196","192.168.1.1","DNS","98","Standard query 0x8368 AAAA ocsp.godaddy.com.akadns.net OPT"
"23","0.285927581","192.168.1.1","192.168.1.196","DNS","98","Standard query response 0x8368 AAAA ocsp.godaddy.com.akadns.net OPT"
"24","0.288347441","192.168.1.196","192.124.249.23","TCP","74","44800  >  80 [SYN] Seq=0 Win=64240 Len=0 MSS=1460 SACK_PERM TSval=1231684612 TSecr=0 WS=128"
"25","0.306793587","192.168.1.196","34.96.118.58","TCP","74","34834  >  443 [SYN] Seq=0 Win=64240 Len=0 MSS=1460 SACK_PERM TSval=4134288235 TSecr=0 WS=128"
"26","0.309641209","192.168.1.196","34.96.118.58","TCP","74","34850  >  443 [SYN] Seq=0 Win=64240 Len=0 MSS=1460 SACK_PERM TSval=4134288238 TSecr=0 WS=128"
"27","0.311633443","34.96.118.58","192.168.1.196","TCP","74","443  >  34834 [SYN, ACK] Seq=0 Ack=1 Win=65535 Len=0 MSS=1412 SACK_PERM TSval=3032609424 TSecr=4134288235 WS=256"
"28","0.311666060","192.168.1.196","34.96.118.58","TCP","66","34834  >  443 [ACK] Seq=1 Ack=1 Win=64256 Len=0 TSval=4134288240 TSecr=3032609424"
"29","0.312422644","192.168.1.196","34.96.118.58","TLSv1.3","1968","Client Hello (SNI=moodlearn.ariel.ac.il)"
"30","0.314003691","34.96.118.58","192.168.1.196","TCP","74","443  >  34850 [SYN, ACK] Seq=0 Ack=1 Win=65535 Len=0 MSS=1412 SACK_PERM TSval=3354010353 TSecr=4134288238 WS=256"
"31","0.314040822","192.168.1.196","34.96.118.58","TCP","66","34850  >  443 [ACK] Seq=1 Ack=1 Win=64256 Len=0 TSval=4134288242 TSecr=3354010353"
"32","0.316216930","192.168.1.196","34.96.118.58","TLSv1.3","1968","Client Hello (SNI=moodlearn.ariel.ac.il)"
"33","0.317591289","192.168.1.196","192.168.1.1","DNS","95","Standard query 0xea00 A www.googletagmanager.com OPT"
"34","0.317786241","192.168.1.196","192.168.1.1","DNS","95","Standard query 0x7fad AAAA www.googletagmanager.com OPT"
"35","0.317900251","192.168.1.196","192.168.1.1","DNS","95","Standard query 0x1a60 HTTPS www.googletagmanager.com OPT"
"36","0.319647079","192.168.1.196","192.168.1.1","DNS","87","Standard query 0x4c6b A cdn.jsdelivr.net OPT"
"37","0.319866149","192.168.1.196","192.168.1.1","DNS","87","Standard query 0x0fed AAAA cdn.jsdelivr.net OPT"
"38","0.320004471","192.168.1.196","192.168.1.1","DNS","87","Standard query 0x0728 HTTPS cdn.jsdelivr.net OPT"
"39","0.322445613","34.96.118.58","192.168.1.196","TCP","66","443  >  34834 [ACK] Seq=1 Ack=1401 Win=267520 Len=0 TSval=3032609429 TSecr=4134288240"
"40","0.322445931","34.96.118.58","192.168.1.196","TCP","66","443  >  34834 [ACK] Seq=1 Ack=1903 Win=267264 Len=0 TSval=3032609429 TSecr=4134288240"
"41","0.322445989","34.96.118.58","192.168.1.196","TLSv1.3","2114","Server Hello, Change Cipher Spec"
"42","0.322446008","34.96.118.58","192.168.1.196","TCP","2114","443  >  34834 [PSH, ACK] Seq=2049 Ack=1903 Win=267264 Len=2048 TSval=3032609432 TSecr=4134288240 [TCP PDU reassembled in 43]"
"43","0.322446027","34.96.118.58","192.168.1.196","TLSv1.3","601","Application Data"
"44","0.322446046","34.96.118.58","192.168.1.196","TCP","66","443  >  34850 [ACK] Seq=1 Ack=1401 Win=267520 Len=0 TSval=3354010360 TSecr=4134288244"
"45","0.322511979","192.168.1.196","34.96.118.58","TCP","66","34834  >  443 [ACK] Seq=1903 Ack=2049 Win=63488 Len=0 TSval=4134288250 TSecr=3032609432"
"46","0.322619654","192.168.1.196","34.96.118.58","TCP","66","34834  >  443 [ACK] Seq=1903 Ack=4097 Win=61568 Len=0 TSval=4134288251 TSecr=3032609432"
"47","0.322652083","192.168.1.196","34.96.118.58","TCP","66","34834  >  443 [ACK] Seq=1903 Ack=4632 Win=61056 Len=0 TSval=4134288251 TSecr=3032609432"
"48","0.322684157","34.96.118.58","192.168.1.196","TCP","66","443  >  34850 [ACK] Seq=1 Ack=1903 Win=267264 Len=0 TSval=3354010360 TSecr=4134288244"
"49","0.322684221","192.168.1.1","192.168.1.196","DNS","111","Standard query response 0xea00 A www.googletagmanager.com A 142.250.75.104 OPT"
"50","0.322684241","192.168.1.1","192.168.1.196","DNS","123","Standard query response 0x7fad AAAA www.googletagmanager.com AAAA 2a00:1450:4028:806::2008 OPT"
"51","0.322684260","192.168.1.1","192.168.1.196","DNS","155","Standard query response 0x1a60 HTTPS www.googletagmanager.com SOA ns1.google.com OPT"
"52","0.324121327","34.96.118.58","192.168.1.196","TLSv1.3","2114","Server Hello, Change Cipher Spec"
"53","0.324121738","192.168.1.1","192.168.1.196","DNS","168","Standard query response 0x4c6b A cdn.jsdelivr.net CNAME cdn.jsdelivr.net.cdn.cloudflare.net A 104.18.186.31 A 104.18.187.31 OPT"
"54","0.324121757","34.96.118.58","192.168.1.196","TCP","2114","443  >  34850 [PSH, ACK] Seq=2049 Ack=1903 Win=267264 Len=2048 TSval=3354010363 TSecr=4134288244 [TCP PDU reassembled in 55]"
"55","0.324121774","34.96.118.58","192.168.1.196","TLSv1.3","601","Application Data"
"56","0.324153933","192.168.1.196","34.96.118.58","TCP","66","34850  >  443 [ACK] Seq=1903 Ack=2049 Win=63488 Len=0 TSval=4134288252 TSecr=3354010363"
"57","0.324338674","192.168.1.196","34.96.118.58","TCP","66","34850  >  443 [ACK] Seq=1903 Ack=4097 Win=61568 Len=0 TSval=4134288252 TSecr=3354010363"
"58","0.324407259","192.168.1.196","34.96.118.58","TCP","66","34850  >  443 [ACK] Seq=1903 Ack=4632 Win=61056 Len=0 TSval=4134288252 TSecr=3354010363"
"59","0.324491378","192.168.1.1","192.168.1.196","DNS","192","Standard query response 0x0fed AAAA cdn.jsdelivr.net CNAME cdn.jsdelivr.net.cdn.cloudflare.net AAAA 2606:4700::6812:ba1f AAAA 2606:4700::6812:bb1f OPT"
"60","0.324491509","192.168.1.1","192.168.1.196","DNS","208","Standard query response 0x0728 HTTPS cdn.jsdelivr.net CNAME cdn.jsdelivr.net.cdn.cloudflare.net SOA ns1.cloudflare.net OPT"
"61","0.325043596","192.168.1.196","192.168.1.1","DNS","106","Standard query 0x6034 HTTPS cdn.jsdelivr.net.cdn.cloudflare.net OPT"
"62","0.329962264","192.168.1.1","192.168.1.196","DNS","178","Standard query response 0x6034 HTTPS cdn.jsdelivr.net.cdn.cloudflare.net SOA ns1.cloudflare.net OPT"
"63","0.336692812","192.168.1.196","192.124.249.23","TCP","74","44804  >  80 [SYN] Seq=0 Win=64240 Len=0 MSS=1460 SACK_PERM TSval=1231684661 TSecr=0 WS=128"
"64","0.336912079","192.168.1.196","192.124.249.23","TCP","74","44820  >  80 [SYN] Seq=0 Win=64240 Len=0 MSS=1460 SACK_PERM TSval=1231684661 TSecr=0 WS=128"
"65","0.352484714","192.124.249.23","192.168.1.196","TCP","74","80  >  44800 [SYN, ACK] Seq=0 Ack=1 Win=21720 Len=0 MSS=1460 SACK_PERM TSval=1145844876 TSecr=1231684612 WS=512"
"66","0.352548815","192.168.1.196","192.124.249.23","TCP","66","44800  >  80 [ACK] Seq=1 Ack=1 Win=64256 Len=0 TSval=1231684677 TSecr=1145844876"
"67","0.352777634","192.168.1.196","192.124.249.23","OCSP","497","Request"
"68","0.394701409","192.124.249.23","192.168.1.196","TCP","74","80  >  44804 [SYN, ACK] Seq=0 Ack=1 Win=21720 Len=0 MSS=1460 SACK_PERM TSval=1145844919 TSecr=1231684661 WS=512"
"69","0.394753090","192.168.1.196","192.124.249.23","TCP","66","44804  >  80 [ACK] Seq=1 Ack=1 Win=64256 Len=0 TSval=1231684719 TSecr=1145844919"
"70","0.395075356","192.168.1.196","192.124.249.23","OCSP","497","Request"
"71","0.399840714","192.124.249.23","192.168.1.196","TCP","74","80  >  44820 [SYN, ACK] Seq=0 Ack=1 Win=21720 Len=0 MSS=1460 SACK_PERM TSval=1145844924 TSecr=1231684661 WS=512"
"72","0.399883336","192.168.1.196","192.124.249.23","TCP","66","44820  >  80 [ACK] Seq=1 Ack=1 Win=64256 Len=0 TSval=1231684724 TSecr=1145844924"
"73","0.400103067","192.168.1.196","192.124.249.23","OCSP","497","Request"
"74","0.417074445","192.124.249.23","192.168.1.196","TCP","66","80  >  44800 [ACK] Seq=1 Ack=432 Win=21504 Len=0 TSval=1145844940 TSecr=1231684677"
"75","0.449304470","192.124.249.23","192.168.1.196","OCSP","2742","Response"
"76","0.449340158","192.168.1.196","192.124.249.23","TCP","66","44800  >  80 [ACK] Seq=432 Ack=2677 Win=69504 Len=0 TSval=1231684773 TSecr=1145844972"
"77","0.452936772","192.124.249.23","192.168.1.196","TCP","66","80  >  44804 [ACK] Seq=1 Ack=432 Win=21504 Len=0 TSval=1145844978 TSecr=1231684719"
"78","0.454099991","192.168.1.196","34.96.118.58","TLSv1.3","130","Change Cipher Spec, Application Data"
"79","0.454430480","192.168.1.196","34.96.118.58","TLSv1.3","158","Application Data"
"80","0.458002069","34.96.118.58","192.168.1.196","TLSv1.3","684","Application Data, Application Data"
"81","0.458002221","34.96.118.58","192.168.1.196","TLSv1.3","97","Application Data"
"82","0.458035928","192.168.1.196","34.96.118.58","TCP","66","34824  >  443 [ACK] Seq=2059 Ack=5250 Win=64128 Len=0 TSval=4134288386 TSecr=2960358912"
"83","0.458092147","192.168.1.196","34.96.118.58","TCP","66","34824  >  443 [ACK] Seq=2059 Ack=5281 Win=64128 Len=0 TSval=4134288386 TSecr=2960358912"
"84","0.458328559","192.168.1.196","34.96.118.58","TLSv1.3","97","Application Data"
"85","0.462717817","192.124.249.23","192.168.1.196","TCP","66","80  >  44820 [ACK] Seq=1 Ack=432 Win=21504 Len=0 TSval=1145844987 TSecr=1231684724"
"86","0.465860316","34.96.118.58","192.168.1.196","TCP","66","443  >  34824 [ACK] Seq=5281 Ack=2090 Win=267264 Len=0 TSval=2960358920 TSecr=4134288386"
"87","0.472401515","192.124.249.23","192.168.1.196","OCSP","2742","Response"
"88","0.472432713","192.168.1.196","192.124.249.23","TCP","66","44804  >  80 [ACK] Seq=432 Ack=2677 Win=69504 Len=0 TSval=1231684796 TSecr=1145844997"
"89","0.473395186","192.168.1.196","34.96.118.58","TLSv1.3","130","Change Cipher Spec, Application Data"
"90","0.473889749","192.168.1.196","34.96.118.58","TLSv1.3","175","Application Data"
"91","0.474282041","192.168.1.196","34.96.118.58","TLSv1.3","796","Application Data"
"92","0.477381627","34.96.118.58","192.168.1.196","TLSv1.3","684","Application Data, Application Data"
"93","0.477381763","34.96.118.58","192.168.1.196","TCP","66","443  >  34824 [ACK] Seq=5281 Ack=2820 Win=266752 Len=0 TSval=2960358931 TSecr=4134288402"
"94","0.477381783","34.96.118.58","192.168.1.196","TLSv1.3","97","Application Data"
"95","0.477415015","192.168.1.196","34.96.118.58","TCP","66","34834  >  443 [ACK] Seq=2076 Ack=5250 Win=64128 Len=0 TSval=4134288405 TSecr=3032609590"
"96","0.477472648","192.168.1.196","34.96.118.58","TCP","66","34834  >  443 [ACK] Seq=2076 Ack=5281 Win=64128 Len=0 TSval=4134288405 TSecr=3032609591"
"97","0.477781582","192.168.1.196","34.96.118.58","TLSv1.3","90","Application Data"
"98","0.477860040","192.168.1.196","34.96.118.58","TCP","66","34834  >  443 [FIN, ACK] Seq=2100 Ack=5281 Win=64128 Len=0 TSval=4134288406 TSecr=3032609591"
"99","0.481530644","34.96.118.58","192.168.1.196","TCP","66","443  >  34834 [FIN, ACK] Seq=5281 Ack=2101 Win=267264 Len=0 TSval=3032609595 TSecr=4134288406"
"100","0.481530829","192.124.249.23","192.168.1.196","OCSP","2742","Response"
"101","0.481553216","192.168.1.196","34.96.118.58","TCP","66","34834  >  443 [ACK] Seq=2101 Ack=5282 Win=64128 Len=0 TSval=4134288410 TSecr=3032609595"
"102","0.481629275","192.168.1.196","192.124.249.23","TCP","66","44820  >  80 [ACK] Seq=432 Ack=2677 Win=69504 Len=0 TSval=1231684806 TSecr=1145845006"
"103","0.483660404","192.168.1.196","34.96.118.58","TLSv1.3","130","Change Cipher Spec, Application Data"
"104","0.484256601","192.168.1.196","34.96.118.58","TLSv1.3","175","Application Data"
"105","0.488594010","34.96.118.58","192.168.1.196","TLSv1.3","684","Application Data, Application Data"
"106","0.488594477","34.96.118.58","192.168.1.196","TLSv1.3","97","Application Data"
"107","0.488626590","192.168.1.196","34.96.118.58","TCP","66","34850  >  443 [ACK] Seq=2076 Ack=5250 Win=64128 Len=0 TSval=4134288417 TSecr=3354010527"
"108","0.488745208","192.168.1.196","34.96.118.58","TCP","66","34850  >  443 [ACK] Seq=2076 Ack=5281 Win=64128 Len=0 TSval=4134288417 TSecr=3354010528"
"109","0.489226942","192.168.1.196","34.96.118.58","TLSv1.3","90","Application Data"
"110","0.489351930","192.168.1.196","34.96.118.58","TCP","66","34850  >  443 [FIN, ACK] Seq=2100 Ack=5281 Win=64128 Len=0 TSval=4134288417 TSecr=3354010528"
"111","0.492865725","34.96.118.58","192.168.1.196","TCP","66","443  >  34850 [FIN, ACK] Seq=5281 Ack=2100 Win=267264 Len=0 TSval=3354010533 TSecr=4134288417"
"112","0.492865889","34.96.118.58","192.168.1.196","TCP","66","443  >  34850 [ACK] Seq=5282 Ack=2101 Win=267264 Len=0 TSval=3354010533 TSecr=4134288417"
"113","0.492895441","192.168.1.196","34.96.118.58","TCP","66","34850  >  443 [ACK] Seq=2101 Ack=5282 Win=64128 Len=0 TSval=4134288421 TSecr=3354010533"
"114","0.547972981","34.96.118.58","192.168.1.196","TLSv1.3","232","Application Data"
"115","0.547973176","34.96.118.58","192.168.1.196","TLSv1.3","556","Application Data"
"116","0.548206334","192.168.1.196","34.96.118.58","TCP","66","34824  >  443 [ACK] Seq=2820 Ack=5937 Win=64128 Len=0 TSval=4134288476 TSecr=2960359002"
"117","0.548756202","34.96.118.58","192.168.1.196","TLSv1.3","105","Application Data"
"118","0.548810920","192.168.1.196","34.96.118.58","TLSv1.3","105","Application Data"
"119","0.551348881","34.96.118.58","192.168.1.196","TCP","66","443  >  34824 [ACK] Seq=5976 Ack=2859 Win=266752 Len=0 TSval=2960359006 TSecr=4134288477"
"120","0.577838063","192.168.1.196","34.120.208.123","TLSv1.2","215","Application Data"
"121","0.579223540","192.168.1.196","34.120.208.123","TLSv1.2","1389","Application Data"
"122","0.581109178","34.120.208.123","192.168.1.196","TCP","66","443  >  39678 [ACK] Seq=1 Ack=150 Win=1015 Len=0 TSval=4219133552 TSecr=1073304849"
"123","0.582200191","34.120.208.123","192.168.1.196","TCP","66","443  >  39678 [ACK] Seq=1 Ack=1473 Win=1010 Len=0 TSval=4219133554 TSecr=1073304850"
"124","0.612919289","192.168.1.196","34.96.118.58","TLSv1.3","241","Application Data"
"125","0.619261610","34.96.118.58","192.168.1.196","TCP","66","443  >  34824 [ACK] Seq=5976 Ack=3034 Win=266752 Len=0 TSval=2960359070 TSecr=4134288541"
"126","0.619261938","34.96.118.58","192.168.1.196","TLSv1.3","213","Application Data"
"127","0.619261966","34.96.118.58","192.168.1.196","TLSv1.3","1466","Application Data"
"128","0.619261985","34.96.118.58","192.168.1.196","TLSv1.3","1466","Application Data"
"129","0.619262003","34.96.118.58","192.168.1.196","TLSv1.3","1466","Application Data"
"130","0.619262021","34.96.118.58","192.168.1.196","TLSv1.3","1466","Application Data"
"131","0.619262039","34.96.118.58","192.168.1.196","TLSv1.3","1466","Application Data"
"132","0.619262058","34.96.118.58","192.168.1.196","TLSv1.3","7060","Application Data, Application Data, Application Data, Application Data, Application Data"
"133","0.619351713","192.168.1.196","34.96.118.58","TCP","66","34824  >  443 [ACK] Seq=3034 Ack=20117 Win=55296 Len=0 TSval=4134288547 TSecr=2960359072"
"134","0.620217334","34.96.118.58","192.168.1.196","TLSv1.3","105","Application Data"
"135","0.620575317","192.168.1.196","34.96.118.58","TLSv1.3","105","Application Data"
"136","0.629826926","34.96.118.58","192.168.1.196","TCP","66","443  >  34824 [ACK] Seq=20156 Ack=3073 Win=266752 Len=0 TSval=2960359083 TSecr=4134288549"
"137","0.745292865","192.168.1.196","34.96.118.58","TLSv1.3","697","Application Data"
"138","0.746966342","192.168.1.196","34.96.118.58","TLSv1.3","221","Application Data"
"139","0.747106537","192.168.1.196","34.96.118.58","TLSv1.3","446","Application Data"
"140","0.749370779","34.96.118.58","192.168.1.196","TCP","66","443  >  34824 [ACK] Seq=20156 Ack=3704 Win=266240 Len=0 TSval=2960359203 TSecr=4134288673"
"141","0.759292027","34.96.118.58","192.168.1.196","TCP","66","443  >  34824 [ACK] Seq=20156 Ack=3859 Win=266240 Len=0 TSval=2960359204 TSecr=4134288675"
"142","0.759292398","34.96.118.58","192.168.1.196","TCP","66","443  >  34824 [ACK] Seq=20156 Ack=4239 Win=265984 Len=0 TSval=2960359204 TSecr=4134288675"
"143","0.799130125","34.120.208.123","192.168.1.196","TLSv1.2","135","Application Data"
"144","0.799130406","34.120.208.123","192.168.1.196","TLSv1.2","297","Application Data"
"145","0.799731528","34.120.208.123","192.168.1.196","TLSv1.2","105","Application Data"
"146","0.801434645","192.168.1.196","34.120.208.123","TCP","66","39678  >  443 [ACK] Seq=1473 Ack=340 Win=591 Len=0 TSval=1073305072 TSecr=4219133771"
"147","0.801650357","192.168.1.196","34.120.208.123","TLSv1.2","105","Application Data"
"148","0.804824608","34.120.208.123","192.168.1.196","TCP","66","443  >  39678 [ACK] Seq=340 Ack=1512 Win=1010 Len=0 TSval=4219133776 TSecr=1073305073"
"149","0.809224392","34.96.118.58","192.168.1.196","TLSv1.3","399","Application Data"
"150","0.809224724","34.96.118.58","192.168.1.196","TLSv1.3","290","Application Data"
"151","0.809405788","192.168.1.196","34.96.118.58","TCP","66","34824  >  443 [ACK] Seq=4239 Ack=20713 Win=64128 Len=0 TSval=4134288737 TSecr=2960359264"
"152","0.810236660","34.96.118.58","192.168.1.196","TLSv1.3","105","Application Data"
"153","0.810295425","192.168.1.196","34.96.118.58","TLSv1.3","105","Application Data"
"154","0.811139468","34.96.118.58","192.168.1.196","TLSv1.3","138","Application Data"
"155","0.811139549","34.96.118.58","192.168.1.196","TLSv1.3","338","Application Data"
"156","0.811248390","192.168.1.196","34.96.118.58","TCP","66","34824  >  443 [ACK] Seq=4278 Ack=21096 Win=64128 Len=0 TSval=4134288739 TSecr=2960359265"
"157","0.813080294","34.96.118.58","192.168.1.196","TCP","66","443  >  34824 [ACK] Seq=21096 Ack=4278 Win=265984 Len=0 TSval=2960359268 TSecr=4134288738"
"158","0.846625146","192.168.1.196","34.96.118.58","TLSv1.3","426","Application Data"
"159","0.850007065","34.96.118.58","192.168.1.196","TCP","66","443  >  34824 [ACK] Seq=21096 Ack=4638 Win=265728 Len=0 TSval=2960359304 TSecr=4134288775"
"160","0.850482837","192.168.1.196","34.96.118.58","TLSv1.3","101","Application Data"
"161","0.853152826","34.96.118.58","192.168.1.196","TCP","66","443  >  34824 [ACK] Seq=21096 Ack=4673 Win=265728 Len=0 TSval=2960359308 TSecr=4134288778"
"162","0.856468610","192.168.1.196","34.96.118.58","TLSv1.3","177","Application Data"
"163","0.863360914","34.96.118.58","192.168.1.196","TCP","66","443  >  34824 [ACK] Seq=21096 Ack=4784 Win=265728 Len=0 TSval=2960359314 TSecr=4134288784"
"164","1.076399077","34.96.118.58","192.168.1.196","TLSv1.3","373","Application Data"
"165","1.076399457","34.96.118.58","192.168.1.196","TLSv1.3","880","Application Data"
"166","1.076399482","34.96.118.58","192.168.1.196","TLSv1.3","881","Application Data"
"167","1.076399509","34.96.118.58","192.168.1.196","TLSv1.3","105","Application Data"
"168","1.076486389","192.168.1.196","34.96.118.58","TCP","66","34824  >  443 [ACK] Seq=4784 Ack=23071 Win=62976 Len=0 TSval=4134289004 TSecr=2960359530"
"169","1.076906928","192.168.1.196","34.96.118.58","TLSv1.3","105","Application Data"
"170","1.079837030","34.96.118.58","192.168.1.196","TCP","66","443  >  34824 [ACK] Seq=23071 Ack=4823 Win=265728 Len=0 TSval=2960359534 TSecr=4134289005"
"171","1.080702284","192.168.1.196","34.96.118.58","TLSv1.3","204","Application Data"
"172","1.083832455","34.96.118.58","192.168.1.196","TCP","66","443  >  34824 [ACK] Seq=23071 Ack=4961 Win=265728 Len=0 TSval=2960359538 TSecr=4134289009"
"173","1.276019514","34.96.118.58","192.168.1.196","TLSv1.3","179","Application Data"
"174","1.276019701","34.96.118.58","192.168.1.196","TLSv1.3","969","Application Data"
"175","1.276019721","34.96.118.58","192.168.1.196","TLSv1.3","801","Application Data"
"176","1.276093705","34.96.118.58","192.168.1.196","TLSv1.3","105","Application Data"
"177","1.276167954","192.168.1.196","34.96.118.58","TCP","66","34824  >  443 [ACK] Seq=4961 Ack=24861 Win=62464 Len=0 TSval=4134289204 TSecr=2960359730"
"178","1.276575438","192.168.1.196","34.96.118.58","TLSv1.3","105","Application Data"
"179","1.279257074","34.96.118.58","192.168.1.196","TCP","66","443  >  34824 [ACK] Seq=24861 Ack=5000 Win=265728 Len=0 TSval=2960359734 TSecr=4134289205"
"180","1.283535202","192.168.1.196","34.96.118.58","TLSv1.3","176","Application Data"
"181","1.287421132","34.96.118.58","192.168.1.196","TCP","66","443  >  34824 [ACK] Seq=24861 Ack=5110 Win=265728 Len=0 TSval=2960359741 TSecr=4134289212"
"182","1.541451691","34.96.118.58","192.168.1.196","TLSv1.3","270","Application Data"
"183","1.541452004","34.96.118.58","192.168.1.196","TLSv1.3","1466","Application Data"
"184","1.541452029","34.96.118.58","192.168.1.196","TLSv1.3","1466","Application Data"
"185","1.541452046","34.96.118.58","192.168.1.196","TLSv1.3","933","Application Data"
"186","1.541452062","34.96.118.58","192.168.1.196","TLSv1.3","1466","Application Data"
"187","1.541452079","34.96.118.58","192.168.1.196","TLSv1.3","1466","Application Data"
"188","1.541602511","192.168.1.196","34.96.118.58","TCP","66","34824  >  443 [ACK] Seq=5110 Ack=31532 Win=59648 Len=0 TSval=4134289470 TSecr=2960359995"
"189","1.556210159","34.96.118.58","192.168.1.196","TLSv1.3","3207","Application Data, Application Data, Application Data, Application Data"
"190","1.556210286","34.96.118.58","192.168.1.196","TLSv1.3","105","Application Data"
"191","1.556239303","192.168.1.196","34.96.118.58","TCP","66","34824  >  443 [ACK] Seq=5110 Ack=34673 Win=62592 Len=0 TSval=4134289484 TSecr=2960359996"
"192","1.556658131","192.168.1.196","34.96.118.58","TLSv1.3","105","Application Data"
"193","1.557192441","34.96.118.58","192.168.1.196","TCP","105","[TCP Spurious Retransmission] 443  >  34824 [PSH, ACK] Seq=34673 Ack=5110 Win=265728 Len=39 TSval=2960360010 TSecr=4134289470"
"194","1.557205575","192.168.1.196","34.96.118.58","TCP","78","[TCP Dup ACK 192#1] 34824  >  443 [ACK] Seq=5149 Ack=34712 Win=64128 Len=0 TSval=4134289485 TSecr=2960360010 SLE=34673 SRE=34712"
"195","1.560024161","34.96.118.58","192.168.1.196","TCP","66","443  >  34824 [ACK] Seq=34712 Ack=5149 Win=265728 Len=0 TSval=2960360014 TSecr=4134289485"
"196","1.582636761","192.168.1.196","34.96.118.58","TLSv1.3","258","Application Data"
"197","1.583017460","192.168.1.196","34.96.118.58","TLSv1.3","198","Application Data"
"198","1.585116035","192.168.1.196","34.96.118.58","TLSv1.3","196","Application Data"
"199","1.585999850","192.168.1.196","34.96.118.58","TLSv1.3","286","Application Data"
"200","1.586659781","192.168.1.196","34.96.118.58","TLSv1.3","201","Application Data"
"201","1.586863275","192.168.1.196","34.96.118.58","TLSv1.3","200","Application Data"
"202","1.587026026","192.168.1.196","34.96.118.58","TLSv1.3","202","Application Data"
"203","1.587195518","192.168.1.196","34.96.118.58","TLSv1.3","211","Application Data"
"204","1.587355838","192.168.1.196","34.96.118.58","TLSv1.3","201","Application Data"
"205","1.589454519","34.96.118.58","192.168.1.196","TCP","66","443  >  34824 [ACK] Seq=34712 Ack=5341 Win=265728 Len=0 TSval=2960360040 TSecr=4134289511"
"206","1.589455296","34.96.118.58","192.168.1.196","TCP","66","443  >  34824 [ACK] Seq=34712 Ack=5473 Win=265728 Len=0 TSval=2960360040 TSecr=4134289511"
"207","1.589455324","34.96.118.58","192.168.1.196","TLSv1.3","274","Application Data"
"208","1.589455351","34.96.118.58","192.168.1.196","TLSv1.3","1466","Application Data"
"209","1.589455368","34.96.118.58","192.168.1.196","TLSv1.3","1466","Application Data"
"210","1.589455384","34.96.118.58","192.168.1.196","TLSv1.3","1466","Application Data"
"211","1.589455401","34.96.118.58","192.168.1.196","TLSv1.3","1466","Application Data"
"212","1.589455417","34.96.118.58","192.168.1.196","TLSv1.3","1466","Application Data"
"213","1.589502902","34.96.118.58","192.168.1.196","TLSv1.3","7066","Application Data, Application Data, Application Data, Application Data, Application Data"
"214","1.589640806","192.168.1.196","34.96.118.58","TCP","66","34824  >  443 [ACK] Seq=6508 Ack=48920 Win=54912 Len=0 TSval=4134289518 TSecr=2960360042"
"215","1.597266237","34.96.118.58","192.168.1.196","TLSv1.3","9866","Application Data, Application Data, Application Data, Application Data, Application Data, Application Data, Application Data"
"216","1.597266486","34.96.118.58","192.168.1.196","TLSv1.3","14066","Application Data, Application Data, Application Data, Application Data, Application Data, Application Data, Application Data, Application Data, Application Data, Application Data"
"217","1.597293187","192.168.1.196","34.96.118.58","TCP","66","34824  >  443 [ACK] Seq=6508 Ack=58720 Win=58752 Len=0 TSval=4134289525 TSecr=2960360043"
"218","1.597380348","34.96.118.58","192.168.1.196","TLSv1.3","14066","Application Data, Application Data, Application Data, Application Data, Application Data, Application Data, Application Data, Application Data, Application Data, Application Data"
"219","1.597402743","34.96.118.58","192.168.1.196","TCP","66","443  >  34824 [ACK] Seq=86720 Ack=5958 Win=265472 Len=0 TSval=2960360046 TSecr=4134289514"
"220","1.597402766","34.96.118.58","192.168.1.196","TLSv1.3","2866","Application Data, Application Data"
"221","1.597402786","34.96.118.58","192.168.1.196","TCP","66","443  >  34824 [ACK] Seq=89520 Ack=6508 Win=264960 Len=0 TSval=2960360046 TSecr=4134289515"
"222","1.598966528","192.168.1.196","34.96.118.58","TCP","66","34824  >  443 [ACK] Seq=6508 Ack=89520 Win=64128 Len=0 TSval=4134289527 TSecr=2960360044"
"223","1.600028136","34.96.118.58","192.168.1.196","TLSv1.3","14066","Application Data, Application Data, Application Data, Application Data, Application Data, Application Data, Application Data, Application Data, Application Data, Application Data"
"224","1.600041443","192.168.1.196","34.96.118.58","TCP","66","34824  >  443 [ACK] Seq=6508 Ack=103520 Win=92160 Len=0 TSval=4134289528 TSecr=2960360047"
"225","1.600232361","34.96.118.58","192.168.1.196","TLSv1.3","4266","Application Data, Application Data, Application Data"
"226","1.600242831","192.168.1.196","34.96.118.58","TCP","66","34824  >  443 [ACK] Seq=6508 Ack=107720 Win=100608 Len=0 TSval=4134289528 TSecr=2960360054"
"227","1.602368555","34.96.118.58","192.168.1.196","TLSv1.3","7066","Application Data, Application Data, Application Data, Application Data, Application Data"
"228","1.602368746","34.96.118.58","192.168.1.196","TLSv1.3","8466","Application Data, Application Data, Application Data, Application Data, Application Data, Application Data"
"229","1.602403005","192.168.1.196","34.96.118.58","TCP","66","34824  >  443 [ACK] Seq=6508 Ack=114720 Win=114560 Len=0 TSval=4134289530 TSecr=2960360054"
"230","1.602473635","192.168.1.196","34.96.118.58","TCP","66","34824  >  443 [ACK] Seq=6508 Ack=123120 Win=131328 Len=0 TSval=4134289530 TSecr=2960360056"
"231","1.604632635","34.96.118.58","192.168.1.196","TLSv1.3","5666","Application Data, Application Data, Application Data, Application Data"
"232","1.604632917","34.96.118.58","192.168.1.196","TLSv1.3","14066","Application Data, Application Data, Application Data, Application Data, Application Data, Application Data, Application Data, Application Data, Application Data, Application Data"
"233","1.604670351","192.168.1.196","34.96.118.58","TCP","66","34824  >  443 [ACK] Seq=6508 Ack=128720 Win=142592 Len=0 TSval=4134289533 TSecr=2960360056"
"234","1.604799575","192.168.1.196","34.96.118.58","TCP","66","34824  >  443 [ACK] Seq=6508 Ack=142720 Win=170496 Len=0 TSval=4134289533 TSecr=2960360057"
"235","1.608299425","34.96.118.58","192.168.1.196","TLSv1.3","14066","Application Data, Application Data, Application Data, Application Data, Application Data, Application Data, Application Data, Application Data, Application Data, Application Data"
"236","1.608332328","192.168.1.196","34.96.118.58","TCP","66","34824  >  443 [ACK] Seq=6508 Ack=156720 Win=198528 Len=0 TSval=4134289536 TSecr=2960360058"
"237","1.608469135","34.96.118.58","192.168.1.196","TLSv1.3","14066","Application Data, Application Data, Application Data, Application Data, Application Data, Application Data, Application Data, Application Data, Application Data, Application Data"
"238","1.608475706","192.168.1.196","34.96.118.58","TCP","66","34824  >  443 [ACK] Seq=6508 Ack=170720 Win=226560 Len=0 TSval=4134289536 TSecr=2960360059"
"239","1.610257141","34.96.118.58","192.168.1.196","TLSv1.3","7066","Application Data, Application Data, Application Data, Application Data, Application Data"
"240","1.610257295","34.96.118.58","192.168.1.196","TLSv1.3","7066","Application Data, Application Data, Application Data, Application Data, Application Data"
"241","1.610275253","192.168.1.196","34.96.118.58","TCP","66","34824  >  443 [ACK] Seq=6508 Ack=177720 Win=240512 Len=0 TSval=4134289538 TSecr=2960360060"
"242","1.610346079","192.168.1.196","34.96.118.58","TCP","66","34824  >  443 [ACK] Seq=6508 Ack=184720 Win=254592 Len=0 TSval=4134289538 TSecr=2960360060"
"243","1.610386970","34.96.118.58","192.168.1.196","TLSv1.3","14066","Application Data, Application Data, Application Data, Application Data, Application Data, Application Data, Application Data, Application Data, Application Data, Application Data"
"244","1.610391295","192.168.1.196","34.96.118.58","TCP","66","34824  >  443 [ACK] Seq=6508 Ack=198720 Win=282496 Len=0 TSval=4134289538 TSecr=2960360061"
"245","1.610421228","34.96.118.58","192.168.1.196","TLSv1.3","2866","Application Data, Application Data, Application Data"
"246","1.610422788","192.168.1.196","34.96.118.58","TCP","66","34824  >  443 [ACK] Seq=6508 Ack=201520 Win=288128 Len=0 TSval=4134289538 TSecr=2960360062"
"247","1.611114665","192.168.1.196","34.96.118.58","TLSv1.3","256","Application Data"
"248","1.611374225","34.96.118.58","192.168.1.196","TLSv1.3","14066","Application Data, Application Data, Application Data, Application Data, Application Data, Application Data, Application Data, Application Data, Application Data, Application Data, Application Data, Application Data"
"249","1.611384502","192.168.1.196","34.96.118.58","TCP","66","34824  >  443 [ACK] Seq=6698 Ack=215520 Win=316160 Len=0 TSval=4134289539 TSecr=2960360062"
"250","1.611443992","34.96.118.58","192.168.1.196","TLSv1.3","14066","Application Data, Application Data, Application Data, Application Data, Application Data, Application Data, Application Data, Application Data, Application Data, Application Data"
"251","1.611449491","192.168.1.196","34.96.118.58","TCP","66","34824  >  443 [ACK] Seq=6698 Ack=229520 Win=344192 Len=0 TSval=4134289539 TSecr=2960360063"
"252","1.613370971","34.96.118.58","192.168.1.196","TLSv1.3","4266","Application Data, Application Data, Application Data"
"253","1.613383608","192.168.1.196","34.96.118.58","TCP","66","34824  >  443 [ACK] Seq=6698 Ack=233720 Win=352512 Len=0 TSval=4134289541 TSecr=2960360066"
"254","1.613870397","192.168.1.196","34.96.118.58","TLSv1.3","248","Application Data"
"255","1.614008098","192.168.1.196","34.96.118.58","TLSv1.3","105","Application Data"
"256","1.616928038","34.96.118.58","192.168.1.196","TLSv1.3","9866","Application Data, Application Data, Application Data, Application Data, Application Data, Application Data, Application Data"
"257","1.616928275","34.96.118.58","192.168.1.196","TLSv1.3","16866","Application Data, Application Data, Application Data, Application Data, Application Data, Application Data, Application Data, Application Data, Application Data, Application Data, Application Data, Application Data"
"258","1.616956191","192.168.1.196","34.96.118.58","TCP","66","34824  >  443 [ACK] Seq=6919 Ack=243520 Win=372096 Len=0 TSval=4134289545 TSecr=2960360066"
"259","1.617029218","192.168.1.196","34.96.118.58","TCP","66","34824  >  443 [ACK] Seq=6919 Ack=260320 Win=405760 Len=0 TSval=4134289545 TSecr=2960360067"
"260","1.617061776","34.96.118.58","192.168.1.196","TLSv1.3","4266","Application Data, Application Data, Application Data"
"261","1.617065641","192.168.1.196","34.96.118.58","TCP","66","34824  >  443 [ACK] Seq=6919 Ack=264520 Win=414208 Len=0 TSval=4134289545 TSecr=2960360070"
"262","1.618715910","34.96.118.58","192.168.1.196","TLSv1.3","5666","Application Data, Application Data, Application Data, Application Data, Application Data, Application Data"
"263","1.618716522","34.96.118.58","192.168.1.196","TLSv1.3","14066","Application Data, Application Data, Application Data, Application Data, Application Data, Application Data, Application Data, Application Data, Application Data, Application Data, Application Data"
"264","1.618736962","192.168.1.196","34.96.118.58","TCP","66","34824  >  443 [ACK] Seq=6919 Ack=270120 Win=425344 Len=0 TSval=4134289547 TSecr=2960360070"
"265","1.618790703","192.168.1.196","34.96.118.58","TCP","66","34824  >  443 [ACK] Seq=6919 Ack=284120 Win=453376 Len=0 TSval=4134289547 TSecr=2960360071"
"266","1.619179565","34.96.118.58","192.168.1.196","TLSv1.3","10351","Application Data, Application Data, Application Data, Application Data, Application Data, Application Data, Application Data, Application Data, Application Data, Application Data, Application Data, Application Data, Application Data, Application Data, Application Data"
"267","1.619193773","192.168.1.196","34.96.118.58","TCP","66","34824  >  443 [ACK] Seq=6919 Ack=294405 Win=473984 Len=0 TSval=4134289547 TSecr=2960360071"
"268","1.619252735","34.96.118.58","192.168.1.196","TLSv1.3","167","Application Data"
"269","1.619252808","34.96.118.58","192.168.1.196","TCP","66","443  >  34824 [ACK] Seq=294506 Ack=6919 Win=264960 Len=0 TSval=2960360072 TSecr=4134289542"
"270","1.620085875","34.96.118.58","192.168.1.196","TLSv1.3","185","Application Data"
"271","1.622878379","192.168.1.196","34.96.118.58","TCP","66","34824  >  443 [ACK] Seq=6919 Ack=294625 Win=473984 Len=0 TSval=4134289551 TSecr=2960360072"
"272","1.623410930","192.168.1.196","34.96.118.58","TLSv1.3","105","Application Data"
"273","1.631535555","34.96.118.58","192.168.1.196","TCP","66","443  >  34824 [ACK] Seq=294625 Ack=6958 Win=264960 Len=0 TSval=2960360086 TSecr=4134289551"
"274","1.686481703","192.168.1.196","192.168.1.1","DNS","95","Standard query 0xfaa3 HTTPS www.googletagmanager.com OPT"
"275","1.691279621","192.168.1.1","192.168.1.196","DNS","155","Standard query response 0xfaa3 HTTPS www.googletagmanager.com SOA ns1.google.com OPT"
"276","1.703174399","2a0d:6fc2:4940:600:20c:29ff:fee3:884c","2a00:1450:4028:806::2008","QUIC","1294","Initial, DCID=b4d188985c84295a, SCID=271146, PKN: 0, CRYPTO"
"277","1.814837692","2a0d:6fc2:4940:600:20c:29ff:fee3:884c","2a00:1450:4028:806::2008","TCP","94","51112  >  443 [SYN] Seq=0 Win=64400 Len=0 MSS=1400 SACK_PERM TSval=2255743352 TSecr=0 WS=128"
"278","1.831622861","192.168.1.196","34.96.118.58","TLSv1.3","332","Application Data"
"279","1.834473531","34.96.118.58","192.168.1.196","TCP","66","443  >  34824 [ACK] Seq=294625 Ack=7224 Win=264704 Len=0 TSval=2960360289 TSecr=4134289760"
"280","1.835799977","192.168.1.196","34.96.118.58","TLSv1.3","712","Application Data"
"281","1.836442582","34.96.118.58","192.168.1.196","TLSv1.3","249","Application Data"
"282","1.836689161","34.96.118.58","192.168.1.196","TLSv1.3","1466","Application Data"
"283","1.836720488","192.168.1.196","34.96.118.58","TCP","66","34824  >  443 [ACK] Seq=7870 Ack=296208 Win=479616 Len=0 TSval=4134289765 TSecr=2960360291"
"284","1.836997391","192.168.1.196","34.96.118.58","TLSv1.3","188","Application Data"
"285","1.837555744","192.168.1.196","34.96.118.58","TLSv1.3","202","Application Data"
"286","1.841442396","34.96.118.58","192.168.1.196","TLSv1.3","1466","Application Data"
"287","1.841442848","34.96.118.58","192.168.1.196","TLSv1.3","1466","Application Data"
"288","1.841442874","34.96.118.58","192.168.1.196","TLSv1.3","1466","Application Data"
"289","1.841442900","34.96.118.58","192.168.1.196","TLSv1.3","1466","Application Data"
"290","1.841442926","34.96.118.58","192.168.1.196","TLSv1.3","1466","Application Data"
"291","1.841442951","34.96.118.58","192.168.1.196","TLSv1.3","1466","Application Data"
"292","1.841442977","34.96.118.58","192.168.1.196","TLSv1.3","1466","Application Data"
"293","1.841443003","34.96.118.58","192.168.1.196","TLSv1.3","1466","Application Data"
"294","1.841579709","192.168.1.196","34.96.118.58","TCP","66","34824  >  443 [ACK] Seq=8128 Ack=299008 Win=485376 Len=0 TSval=4134289770 TSecr=2960360291"
"295","1.841670920","192.168.1.196","34.96.118.58","TCP","66","34824  >  443 [ACK] Seq=8128 Ack=301808 Win=491264 Len=0 TSval=4134289770 TSecr=2960360291"
"296","1.841698222","192.168.1.196","34.96.118.58","TCP","66","34824  >  443 [ACK] Seq=8128 Ack=304608 Win=497024 Len=0 TSval=4134289770 TSecr=2960360291"
"297","1.841718235","192.168.1.196","34.96.118.58","TCP","66","34824  >  443 [ACK] Seq=8128 Ack=307408 Win=502784 Len=0 TSval=4134289770 TSecr=2960360291"
"298","1.841755818","34.96.118.58","192.168.1.196","TLSv1.3","1466","Application Data"
"299","1.841755916","34.96.118.58","192.168.1.196","TLSv1.3","1466","Application Data"
"300","1.841755933","34.96.118.58","192.168.1.196","TLSv1.3","15466","Application Data, Application Data, Application Data, Application Data, Application Data, Application Data, Application Data, Application Data, Application Data, Application Data, Application Data"
"301","1.841762617","192.168.1.196","34.96.118.58","TCP","66","34824  >  443 [ACK] Seq=8128 Ack=310208 Win=508544 Len=0 TSval=4134289770 TSecr=2960360291"
"302","1.841787036","192.168.1.196","34.96.118.58","TCP","66","34824  >  443 [ACK] Seq=8128 Ack=325608 Win=539392 Len=0 TSval=4134289770 TSecr=2960360291"
