"No.","Time","Source","Destination","Protocol","Length","Info"
"1","0.000000000","2a0d:6fc2:4940:600:20c:29ff:fee3:884c","2a00:1450:4028:805::2004","TLSv1.2","178","Application Data"
"2","0.002306651","2a0d:6fc2:4940:600:20c:29ff:fee3:884c","2a00:1450:4028:805::2004","TCP","1474","54826  >  443 [ACK] Seq=93 Ack=1 Win=542 Len=1388 TSval=2296235854 TSecr=2541234966 [TCP PDU reassembled in 3]"
"3","0.002311838","2a0d:6fc2:4940:600:20c:29ff:fee3:884c","2a00:1450:4028:805::2004","TLSv1.2","793","Application Data"
"4","0.002615708","2a0d:6fc2:4940:600:20c:29ff:fee3:884c","2a00:1450:4028:805::2004","TLSv1.2","259","Application Data"
"5","0.005235552","2a00:1450:4028:805::2004","2a0d:6fc2:4940:600:20c:29ff:fee3:884c","TCP","86","443  >  54826 [ACK] Seq=1 Ack=93 Win=1046 Len=0 TSval=2541242448 TSecr=2296235852"
"6","0.005235728","2a00:1450:4028:805::2004","2a0d:6fc2:4940:600:20c:29ff:fee3:884c","TLSv1.2","1102","Application Data, Application Data"
"7","0.005235748","2a00:1450:4028:805::2004","2a0d:6fc2:4940:600:20c:29ff:fee3:884c","TLSv1.2","117","Application Data"
"8","0.005235764","2a00:1450:4028:805::2004","2a0d:6fc2:4940:600:20c:29ff:fee3:884c","TCP","86","443  >  54826 [ACK] Seq=1048 Ack=2188 Win=1038 Len=0 TSval=2541242450 TSecr=2296235854"
"9","0.006547983","2a0d:6fc2:4940:600:20c:29ff:fee3:884c","2a00:1450:4028:805::2004","TCP","86","54826  >  443 [ACK] Seq=2361 Ack=1048 Win=559 Len=0 TSval=2296235859 TSecr=2541242448"
"10","0.006882598","2a0d:6fc2:4940:600:20c:29ff:fee3:884c","2a00:1450:4028:805::2004","TLSv1.2","117","Application Data"
"11","0.016488916","2a0d:6fc2:4940:600:20c:29ff:fee3:884c","2a00:1450:4028:805::2004","TCP","117","[TCP Retransmission] 54826  >  443 [PSH, ACK] Seq=2361 Ack=1048 Win=559 Len=31 TSval=2296235869 TSecr=2541242448"
"12","0.021178946","2a00:1450:4028:805::2004","2a0d:6fc2:4940:600:20c:29ff:fee3:884c","TCP","86","443  >  54826 [ACK] Seq=1048 Ack=2361 Win=1038 Len=0 TSval=2541242454 TSecr=2296235855"
"13","0.021179265","2a00:1450:4028:805::2004","2a0d:6fc2:4940:600:20c:29ff:fee3:884c","TCP","86","443  >  54826 [ACK] Seq=1048 Ack=2392 Win=1038 Len=0 TSval=2541242459 TSecr=2296235859"
"14","0.021179285","2a00:1450:4028:805::2004","2a0d:6fc2:4940:600:20c:29ff:fee3:884c","TCP","98","[TCP Dup ACK 13#1] 443  >  54826 [ACK] Seq=1048 Ack=2392 Win=1038 Len=0 TSval=2541242464 TSecr=2296235869 SLE=2361 SRE=2392"
"15","0.104123336","2a00:1450:4028:805::2004","2a0d:6fc2:4940:600:20c:29ff:fee3:884c","TLSv1.2","1294","Application Data"
"16","0.104430071","2a00:1450:4028:805::2004","2a0d:6fc2:4940:600:20c:29ff:fee3:884c","TLSv1.2","145","Application Data"
"17","0.104430197","2a00:1450:4028:805::2004","2a0d:6fc2:4940:600:20c:29ff:fee3:884c","TLSv1.2","1294","Application Data"
"18","0.104430224","2a00:1450:4028:805::2004","2a0d:6fc2:4940:600:20c:29ff:fee3:884c","TLSv1.2","1294","Application Data"
"19","0.104430242","2a00:1450:4028:805::2004","2a0d:6fc2:4940:600:20c:29ff:fee3:884c","TLSv1.2","866","Application Data"
"20","0.104444858","2a0d:6fc2:4940:600:20c:29ff:fee3:884c","2a00:1450:4028:805::2004","TCP","86","54826  >  443 [ACK] Seq=2392 Ack=2315 Win=559 Len=0 TSval=2296235956 TSecr=2541242549"
"21","0.104584478","2a0d:6fc2:4940:600:20c:29ff:fee3:884c","2a00:1450:4028:805::2004","TCP","86","54826  >  443 [ACK] Seq=2392 Ack=5511 Win=559 Len=0 TSval=2296235957 TSecr=2541242549"
"22","0.106162088","2a00:1450:4028:805::2004","2a0d:6fc2:4940:600:20c:29ff:fee3:884c","TLSv1.2","118","Application Data"
"23","0.106162216","2a00:1450:4028:805::2004","2a0d:6fc2:4940:600:20c:29ff:fee3:884c","TLSv1.2","117","Application Data"
"24","0.106162235","2a00:1450:4028:805::2004","2a0d:6fc2:4940:600:20c:29ff:fee3:884c","TLSv1.2","125","Application Data"
"25","0.106203496","2a0d:6fc2:4940:600:20c:29ff:fee3:884c","2a00:1450:4028:805::2004","TCP","86","54826  >  443 [ACK] Seq=2392 Ack=5613 Win=559 Len=0 TSval=2296235958 TSecr=2541242549"
"26","0.107631425","2a0d:6fc2:4940:600:20c:29ff:fee3:884c","2a00:1450:4028:805::2004","TLSv1.2","125","Application Data"
"27","0.110383619","2a00:1450:4028:805::2004","2a0d:6fc2:4940:600:20c:29ff:fee3:884c","TCP","86","443  >  54826 [ACK] Seq=5613 Ack=2431 Win=1038 Len=0 TSval=2541242555 TSecr=2296235960"
"28","0.113751656","2a00:1450:4028:805::2004","2a0d:6fc2:4940:600:20c:29ff:fee3:884c","TLSv1.2","771","Application Data"
"29","0.113751782","2a00:1450:4028:805::2004","2a0d:6fc2:4940:600:20c:29ff:fee3:884c","TLSv1.2","1294","Application Data"
"30","0.113830071","2a0d:6fc2:4940:600:20c:29ff:fee3:884c","2a00:1450:4028:805::2004","TCP","86","54826  >  443 [ACK] Seq=2431 Ack=7506 Win=559 Len=0 TSval=2296235966 TSecr=2541242559"
"31","0.114018186","2a00:1450:4028:805::2004","2a0d:6fc2:4940:600:20c:29ff:fee3:884c","TLSv1.2","1294","Application Data"
"32","0.114018285","2a00:1450:4028:805::2004","2a0d:6fc2:4940:600:20c:29ff:fee3:884c","TLSv1.2","865","Application Data"
"33","0.114018382","2a00:1450:4028:805::2004","2a0d:6fc2:4940:600:20c:29ff:fee3:884c","TLSv1.2","118","Application Data"
"34","0.114564250","2a00:1450:4028:805::2004","2a0d:6fc2:4940:600:20c:29ff:fee3:884c","TLSv1.2","117","Application Data"
"35","0.114564348","2a00:1450:4028:805::2004","2a0d:6fc2:4940:600:20c:29ff:fee3:884c","TLSv1.2","125","Application Data"
"36","0.115294884","2a0d:6fc2:4940:600:20c:29ff:fee3:884c","2a00:1450:4028:805::2004","TCP","86","54826  >  443 [ACK] Seq=2431 Ack=9595 Win=559 Len=0 TSval=2296235967 TSecr=2541242559"
"37","0.115923033","2a0d:6fc2:4940:600:20c:29ff:fee3:884c","2a00:1450:4028:805::2004","TLSv1.2","125","Application Data"
"38","0.122872672","2a00:1450:4028:805::2004","2a0d:6fc2:4940:600:20c:29ff:fee3:884c","TCP","86","443  >  54826 [ACK] Seq=9595 Ack=2470 Win=1038 Len=0 TSval=2541242568 TSecr=2296235968"
"39","0.764743529","2a0d:6fc2:4940:600:20c:29ff:fee3:884c","2a00:1450:4028:805::2004","TCP","1474","54826  >  443 [ACK] Seq=2470 Ack=9595 Win=559 Len=1388 TSval=2296236617 TSecr=2541242568 [TCP PDU reassembled in 41]"
"40","0.764749992","2a0d:6fc2:4940:600:20c:29ff:fee3:884c","2a00:1450:4028:805::2004","TCP","1474","54826  >  443 [ACK] Seq=3858 Ack=9595 Win=559 Len=1388 TSval=2296236617 TSecr=2541242568 [TCP PDU reassembled in 41]"
"41","0.764751232","2a0d:6fc2:4940:600:20c:29ff:fee3:884c","2a00:1450:4028:805::2004","TLSv1.2","139","Application Data"
"42","0.767385511","2a00:1450:4028:805::2004","2a0d:6fc2:4940:600:20c:29ff:fee3:884c","TCP","86","443  >  54826 [ACK] Seq=9595 Ack=3858 Win=1033 Len=0 TSval=2541243212 TSecr=2296236617"
"43","0.767386116","2a00:1450:4028:805::2004","2a0d:6fc2:4940:600:20c:29ff:fee3:884c","TCP","98","[TCP Dup ACK 42#1] 443  >  54826 [ACK] Seq=9595 Ack=3858 Win=1033 Len=0 TSval=2541243212 TSecr=2296236617 SLE=5246 SRE=5299"
"44","0.767386144","2a00:1450:4028:805::2004","2a0d:6fc2:4940:600:20c:29ff:fee3:884c","TCP","86","443  >  54826 [ACK] Seq=9595 Ack=5299 Win=1028 Len=0 TSval=2541243212 TSecr=2296236617"
"45","0.897683136","2a00:1450:4028:805::2004","2a0d:6fc2:4940:600:20c:29ff:fee3:884c","TLSv1.2","802","Application Data"
"46","0.897683319","2a00:1450:4028:805::2004","2a0d:6fc2:4940:600:20c:29ff:fee3:884c","TLSv1.2","1294","Application Data"
"47","0.897810029","2a0d:6fc2:4940:600:20c:29ff:fee3:884c","2a00:1450:4028:805::2004","TCP","86","54826  >  443 [ACK] Seq=5299 Ack=11519 Win=559 Len=0 TSval=2296236750 TSecr=2541243342"
"48","0.900632956","2a00:1450:4028:805::2004","2a0d:6fc2:4940:600:20c:29ff:fee3:884c","TLSv1.2","1294","Application Data"
"49","0.900633255","2a00:1450:4028:805::2004","2a0d:6fc2:4940:600:20c:29ff:fee3:884c","TLSv1.2","1294","Application Data"
"50","0.900633275","2a00:1450:4028:805::2004","2a0d:6fc2:4940:600:20c:29ff:fee3:884c","TLSv1.2","869","Application Data"
"51","0.900633293","2a00:1450:4028:805::2004","2a0d:6fc2:4940:600:20c:29ff:fee3:884c","TLSv1.2","233","Application Data"
"52","0.900787642","2a0d:6fc2:4940:600:20c:29ff:fee3:884c","2a00:1450:4028:805::2004","TCP","86","54826  >  443 [ACK] Seq=5299 Ack=14865 Win=559 Len=0 TSval=2296236753 TSecr=2541243342"
"53","0.902670514","2a00:1450:4028:805::2004","2a0d:6fc2:4940:600:20c:29ff:fee3:884c","TLSv1.2","1294","Application Data"
"54","0.902670781","2a00:1450:4028:805::2004","2a0d:6fc2:4940:600:20c:29ff:fee3:884c","TLSv1.2","1294","Application Data"
"55","0.902670832","2a00:1450:4028:805::2004","2a0d:6fc2:4940:600:20c:29ff:fee3:884c","TLSv1.2","1294","Application Data"
"56","0.904248328","2a0d:6fc2:4940:600:20c:29ff:fee3:884c","2a00:1450:4028:805::2004","TCP","86","54826  >  443 [ACK] Seq=5299 Ack=18489 Win=559 Len=0 TSval=2296236756 TSecr=2541243347"
"57","0.908110551","2a00:1450:4028:805::2004","2a0d:6fc2:4940:600:20c:29ff:fee3:884c","TLSv1.2","1294","Application Data"
"58","0.908111016","2a00:1450:4028:805::2004","2a0d:6fc2:4940:600:20c:29ff:fee3:884c","TLSv1.2","1294","Application Data"
"59","0.908111034","2a00:1450:4028:805::2004","2a0d:6fc2:4940:600:20c:29ff:fee3:884c","TLSv1.2","1294","Application Data"
"60","0.908111051","2a00:1450:4028:805::2004","2a0d:6fc2:4940:600:20c:29ff:fee3:884c","TLSv1.2","1294","Application Data"
"61","0.908111067","2a00:1450:4028:805::2004","2a0d:6fc2:4940:600:20c:29ff:fee3:884c","TLSv1.2","1294","Application Data"
"62","0.908111084","2a00:1450:4028:805::2004","2a0d:6fc2:4940:600:20c:29ff:fee3:884c","TLSv1.2","7123","Application Data, Application Data, Application Data, Application Data, Application Data, Application Data"
"63","0.908142286","2a0d:6fc2:4940:600:20c:29ff:fee3:884c","2a00:1450:4028:805::2004","TCP","86","54826  >  443 [ACK] Seq=5299 Ack=20905 Win=602 Len=0 TSval=2296236760 TSecr=2541243347"
"64","0.908243446","2a0d:6fc2:4940:600:20c:29ff:fee3:884c","2a00:1450:4028:805::2004","TCP","86","54826  >  443 [ACK] Seq=5299 Ack=23321 Win=646 Len=0 TSval=2296236760 TSecr=2541243347"
"65","0.908269389","2a0d:6fc2:4940:600:20c:29ff:fee3:884c","2a00:1450:4028:805::2004","TCP","86","54826  >  443 [ACK] Seq=5299 Ack=31566 Win=777 Len=0 TSval=2296236760 TSecr=2541243347"
"66","0.908300618","2a00:1450:4028:805::2004","2a0d:6fc2:4940:600:20c:29ff:fee3:884c","TLSv1.2","1294","Application Data"
"67","0.908300684","2a00:1450:4028:805::2004","2a0d:6fc2:4940:600:20c:29ff:fee3:884c","TLSv1.2","1294","Application Data"
"68","0.908300703","2a00:1450:4028:805::2004","2a0d:6fc2:4940:600:20c:29ff:fee3:884c","TLSv1.2","1294","Application Data"
"69","0.908300722","2a00:1450:4028:805::2004","2a0d:6fc2:4940:600:20c:29ff:fee3:884c","TLSv1.2","1294","Application Data"
"70","0.908300746","2a00:1450:4028:805::2004","2a0d:6fc2:4940:600:20c:29ff:fee3:884c","TLSv1.2","1294","Application Data"
"71","0.908304231","2a0d:6fc2:4940:600:20c:29ff:fee3:884c","2a00:1450:4028:805::2004","TCP","86","54826  >  443 [ACK] Seq=5299 Ack=33982 Win=804 Len=0 TSval=2296236760 TSecr=2541243352"
"72","0.909012248","2a0d:6fc2:4940:600:20c:29ff:fee3:884c","2a00:1450:4028:805::2004","TCP","86","54826  >  443 [ACK] Seq=5299 Ack=37606 Win=779 Len=0 TSval=2296236761 TSecr=2541243352"
"73","0.910930678","2a00:1450:4028:805::2004","2a0d:6fc2:4940:600:20c:29ff:fee3:884c","TLSv1.2","1294","Application Data"
"74","0.910930972","2a00:1450:4028:805::2004","2a0d:6fc2:4940:600:20c:29ff:fee3:884c","TLSv1.2","1294","Application Data"
"75","0.910930998","2a00:1450:4028:805::2004","2a0d:6fc2:4940:600:20c:29ff:fee3:884c","TLSv1.2","1294","Application Data"
"76","0.910931023","2a00:1450:4028:805::2004","2a0d:6fc2:4940:600:20c:29ff:fee3:884c","TLSv1.2","7123","Application Data, Application Data, Application Data, Application Data, Application Data, Application Data"
"77","0.910953282","2a0d:6fc2:4940:600:20c:29ff:fee3:884c","2a00:1450:4028:805::2004","TCP","86","54826  >  443 [ACK] Seq=5299 Ack=40022 Win=847 Len=0 TSval=2296236763 TSecr=2541243352"
"78","0.912775369","2a00:1450:4028:805::2004","2a0d:6fc2:4940:600:20c:29ff:fee3:884c","TLSv1.2","1294","Application Data"
"79","0.912775521","2a00:1450:4028:805::2004","2a0d:6fc2:4940:600:20c:29ff:fee3:884c","TLSv1.2","1294","Application Data"
"80","0.912775544","2a00:1450:4028:805::2004","2a0d:6fc2:4940:600:20c:29ff:fee3:884c","TLSv1.2","1294","Application Data"
"81","0.912775568","2a00:1450:4028:805::2004","2a0d:6fc2:4940:600:20c:29ff:fee3:884c","TLSv1.2","1294","Application Data"
"82","0.912775587","2a00:1450:4028:805::2004","2a0d:6fc2:4940:600:20c:29ff:fee3:884c","TLSv1.2","1294","Application Data"
"83","0.912775605","2a00:1450:4028:805::2004","2a0d:6fc2:4940:600:20c:29ff:fee3:884c","TLSv1.2","1294","Application Data"
"84","0.913738296","2a0d:6fc2:4940:600:20c:29ff:fee3:884c","2a00:1450:4028:805::2004","TCP","86","54826  >  443 [ACK] Seq=5299 Ack=55515 Win=787 Len=0 TSval=2296236766 TSecr=2541243352"
"85","0.918115360","2a00:1450:4028:805::2004","2a0d:6fc2:4940:600:20c:29ff:fee3:884c","TLSv1.2","1294","Application Data"
"86","0.918115776","2a00:1450:4028:805::2004","2a0d:6fc2:4940:600:20c:29ff:fee3:884c","TLSv1.2","3710","Application Data, Application Data, Application Data"
"87","0.918115802","2a00:1450:4028:805::2004","2a0d:6fc2:4940:600:20c:29ff:fee3:884c","TLSv1.2","4462","Application Data, Application Data, Application Data, Application Data"
"88","0.918172466","2a0d:6fc2:4940:600:20c:29ff:fee3:884c","2a00:1450:4028:805::2004","TCP","86","54826  >  443 [ACK] Seq=5299 Ack=60347 Win=879 Len=0 TSval=2296236770 TSecr=2541243357"
"89","0.918794363","2a0d:6fc2:4940:600:20c:29ff:fee3:884c","2a00:1450:4028:805::2004","TCP","86","54826  >  443 [ACK] Seq=5299 Ack=64723 Win=891 Len=0 TSval=2296236771 TSecr=2541243357"
"90","0.928686777","2a0d:6fc2:4940:600:20c:29ff:fee3:884c","2a00:1450:4028:806::200a","TLSv1.2","152","Application Data"
"91","0.928976836","2a0d:6fc2:4940:600:20c:29ff:fee3:884c","2a00:1450:4028:806::200a","TLSv1.2","406","Application Data"
"92","0.929225256","2a0d:6fc2:4940:600:20c:29ff:fee3:884c","2a00:1450:4028:805::2004","TLSv1.2","898","Application Data"
"93","0.931197775","2a00:1450:4028:805::2004","2a0d:6fc2:4940:600:20c:29ff:fee3:884c","TCP","86","443  >  54826 [ACK] Seq=64723 Ack=6111 Win=1025 Len=0 TSval=2541243377 TSecr=2296236781"
"94","0.933870220","2a00:1450:4028:806::200a","2a0d:6fc2:4940:600:20c:29ff:fee3:884c","TCP","86","443  >  37248 [ACK] Seq=1 Ack=67 Win=1046 Len=0 TSval=1515873604 TSecr=993043018"
"95","0.933870511","2a00:1450:4028:806::200a","2a0d:6fc2:4940:600:20c:29ff:fee3:884c","TCP","86","443  >  37248 [ACK] Seq=1 Ack=387 Win=1045 Len=0 TSval=1515873604 TSecr=993043018"
"96","0.962741523","192.168.1.196","192.168.1.1","DNS","87","Standard query 0xa6f4 HTTPS lh2.l.google.com OPT"
"97","0.966296350","192.168.1.1","192.168.1.196","DNS","147","Standard query response 0xa6f4 HTTPS lh2.l.google.com SOA ns1.google.com OPT"
"98","0.968034559","2a0d:6fc2:4940:600:20c:29ff:fee3:884c","2a00:1450:4028:804::200e","TCP","94","43620  >  443 [SYN] Seq=0 Win=64400 Len=0 MSS=1400 SACK_PERM TSval=2183852152 TSecr=0 WS=128"
"99","0.969386317","2a00:1450:4028:805::2004","2a0d:6fc2:4940:600:20c:29ff:fee3:884c","TLSv1.2","350","Application Data"
"100","0.971524979","2a00:1450:4028:804::200e","2a0d:6fc2:4940:600:20c:29ff:fee3:884c","TCP","94","443  >  43620 [SYN, ACK] Seq=0 Ack=1 Win=65535 Len=0 MSS=1400 SACK_PERM TSval=2723335697 TSecr=2183852152 WS=256"
"101","0.971553861","2a0d:6fc2:4940:600:20c:29ff:fee3:884c","2a00:1450:4028:804::200e","TCP","86","43620  >  443 [ACK] Seq=1 Ack=1 Win=64512 Len=0 TSval=2183852156 TSecr=2723335697"
"102","0.971809390","2a0d:6fc2:4940:600:20c:29ff:fee3:884c","2a00:1450:4028:804::200e","TCP","1474","43620  >  443 [ACK] Seq=1 Ack=1 Win=64512 Len=1388 TSval=2183852156 TSecr=2723335697 [TCP PDU reassembled in 103]"
"103","0.971812092","2a0d:6fc2:4940:600:20c:29ff:fee3:884c","2a00:1450:4028:804::200e","TLSv1.3","454","Client Hello (SNI=lh3.google.com)"
"104","0.973777692","2a00:1450:4028:805::2004","2a0d:6fc2:4940:600:20c:29ff:fee3:884c","TLSv1.2","1294","Application Data"
"105","0.973802690","2a0d:6fc2:4940:600:20c:29ff:fee3:884c","2a00:1450:4028:805::2004","TCP","86","54826  >  443 [ACK] Seq=6111 Ack=66195 Win=931 Len=0 TSval=2296236826 TSecr=2541243415"
"106","0.974633190","2a00:1450:4028:805::2004","2a0d:6fc2:4940:600:20c:29ff:fee3:884c","TLSv1.2","1294","Application Data"
"107","0.974633288","2a00:1450:4028:805::2004","2a0d:6fc2:4940:600:20c:29ff:fee3:884c","TLSv1.2","1294","Application Data"
"108","0.974633307","2a00:1450:4028:805::2004","2a0d:6fc2:4940:600:20c:29ff:fee3:884c","TLSv1.2","1294","Application Data"
"109","0.974646626","2a0d:6fc2:4940:600:20c:29ff:fee3:884c","2a00:1450:4028:805::2004","TCP","86","54826  >  443 [ACK] Seq=6111 Ack=68611 Win=974 Len=0 TSval=2296236827 TSecr=2541243419"
"110","0.980939179","2a00:1450:4028:805::2004","2a0d:6fc2:4940:600:20c:29ff:fee3:884c","TLSv1.2","1294","Application Data"
"111","0.980939495","2a00:1450:4028:805::2004","2a0d:6fc2:4940:600:20c:29ff:fee3:884c","TLSv1.2","1294","Application Data"
"112","0.980939520","2a00:1450:4028:805::2004","2a0d:6fc2:4940:600:20c:29ff:fee3:884c","TLSv1.2","1294","Application Data"
"113","0.980939547","2a00:1450:4028:805::2004","2a0d:6fc2:4940:600:20c:29ff:fee3:884c","TLSv1.2","8331","Application Data, Application Data, Application Data, Application Data, Application Data, Application Data, Application Data"
"114","0.980974183","2a0d:6fc2:4940:600:20c:29ff:fee3:884c","2a00:1450:4028:805::2004","TCP","86","54826  >  443 [ACK] Seq=6111 Ack=71027 Win=1015 Len=0 TSval=2296236833 TSecr=2541243419"
"115","0.981098292","192.168.1.196","192.168.1.1","DNS","95","Standard query 0x003b AAAA www.googleadservices.com OPT"
"116","0.981139473","2a00:1450:4028:804::200e","2a0d:6fc2:4940:600:20c:29ff:fee3:884c","TCP","86","443  >  43620 [ACK] Seq=1 Ack=1389 Win=268544 Len=0 TSval=2723335700 TSecr=2183852156"
"117","0.981139560","2a00:1450:4028:804::200e","2a0d:6fc2:4940:600:20c:29ff:fee3:884c","TCP","86","443  >  43620 [ACK] Seq=1 Ack=1757 Win=268288 Len=0 TSval=2723335700 TSecr=2183852156"
"118","0.981139586","2a00:1450:4028:805::2004","2a0d:6fc2:4940:600:20c:29ff:fee3:884c","TLSv1.2","1294","Application Data"
"119","0.981139612","2a00:1450:4028:805::2004","2a0d:6fc2:4940:600:20c:29ff:fee3:884c","TLSv1.2","1294","Application Data"
"120","0.981139639","2a00:1450:4028:805::2004","2a0d:6fc2:4940:600:20c:29ff:fee3:884c","TLSv1.2","1294","Application Data"
"121","0.981139664","2a00:1450:4028:805::2004","2a0d:6fc2:4940:600:20c:29ff:fee3:884c","TLSv1.2","1294","Application Data"
"122","0.981139691","2a00:1450:4028:805::2004","2a0d:6fc2:4940:600:20c:29ff:fee3:884c","TLSv1.2","1294","Application Data"
"123","0.981139716","2a00:1450:4028:805::2004","2a0d:6fc2:4940:600:20c:29ff:fee3:884c","TLSv1.2","1294","Application Data"
"124","0.981167645","2a00:1450:4028:805::2004","2a0d:6fc2:4940:600:20c:29ff:fee3:884c","TLSv1.2","1294","Application Data"
"125","0.981167672","2a00:1450:4028:805::2004","2a0d:6fc2:4940:600:20c:29ff:fee3:884c","TLSv1.2","8229","Application Data, Application Data, Application Data, Application Data, Application Data, Application Data, Application Data"
"126","0.981318726","192.168.1.196","192.168.1.1","DNS","95","Standard query 0xaa95 A www.googleadservices.com OPT"
"127","0.982332524","2a0d:6fc2:4940:600:20c:29ff:fee3:884c","2a00:1450:4028:805::2004","TCP","86","54826  >  443 [ACK] Seq=6111 Ack=98287 Win=822 Len=0 TSval=2296236834 TSecr=2541243419"
"128","0.982950274","2a0d:6fc2:4940:600:20c:29ff:fee3:884c","2a00:1450:4028:805::2004","TCP","1474","54826  >  443 [ACK] Seq=6111 Ack=98287 Win=1015 Len=1388 TSval=2296236835 TSecr=2541243419 [TCP PDU reassembled in 129]"
"129","0.982953599","2a0d:6fc2:4940:600:20c:29ff:fee3:884c","2a00:1450:4028:805::2004","TLSv1.2","1214","Application Data"
"130","0.983579590","2a00:1450:4028:805::2004","2a0d:6fc2:4940:600:20c:29ff:fee3:884c","TLSv1.2","219","Application Data"
"131","0.984311852","192.168.1.1","192.168.1.196","DNS","155","Standard query response 0x003b AAAA www.googleadservices.com SOA ns1.google.com OPT"
"132","0.985765335","192.168.1.1","192.168.1.196","DNS","111","Standard query response 0xaa95 A www.googleadservices.com A 142.250.75.66 OPT"
"133","0.985765522","2a00:1450:4028:805::2004","2a0d:6fc2:4940:600:20c:29ff:fee3:884c","TCP","86","443  >  54826 [ACK] Seq=98420 Ack=8627 Win=1016 Len=0 TSval=2541243430 TSecr=2296236835"
"134","0.986405547","192.168.1.196","142.250.75.66","TCP","74","39200  >  443 [SYN] Seq=0 Win=64240 Len=0 MSS=1460 SACK_PERM TSval=1596155327 TSecr=0 WS=128"
"135","0.989184949","2a00:1450:4028:805::2004","2a0d:6fc2:4940:600:20c:29ff:fee3:884c","TLSv1.2","1294","Application Data"
"136","0.989185331","2a00:1450:4028:805::2004","2a0d:6fc2:4940:600:20c:29ff:fee3:884c","TLSv1.2","1294","Application Data"
"137","0.989185350","2a00:1450:4028:805::2004","2a0d:6fc2:4940:600:20c:29ff:fee3:884c","TLSv1.2","1294","Application Data"
"138","0.989185367","2a00:1450:4028:805::2004","2a0d:6fc2:4940:600:20c:29ff:fee3:884c","TLSv1.2","1294","Application Data"
"139","0.989185383","2a00:1450:4028:805::2004","2a0d:6fc2:4940:600:20c:29ff:fee3:884c","TLSv1.2","1294","Application Data"
"140","0.989185402","2a00:1450:4028:805::2004","2a0d:6fc2:4940:600:20c:29ff:fee3:884c","TLSv1.2","1294","Application Data"
"141","0.989216366","2a0d:6fc2:4940:600:20c:29ff:fee3:884c","2a00:1450:4028:805::2004","TCP","86","54826  >  443 [ACK] Seq=8627 Ack=99628 Win=1015 Len=0 TSval=2296236841 TSecr=2541243425"
"142","0.989610114","2a0d:6fc2:4940:600:20c:29ff:fee3:884c","2a00:1450:4028:805::2004","TCP","86","54826  >  443 [ACK] Seq=8627 Ack=105668 Win=1019 Len=0 TSval=2296236842 TSecr=2541243434"
"143","0.991429235","2a00:1450:4028:805::2004","2a0d:6fc2:4940:600:20c:29ff:fee3:884c","TLSv1.2","1294","Application Data"
"144","0.991429707","2a00:1450:4028:805::2004","2a0d:6fc2:4940:600:20c:29ff:fee3:884c","TLSv1.2","4918","Application Data, Application Data, Application Data, Application Data"
"145","0.991429731","2a00:1450:4028:805::2004","2a0d:6fc2:4940:600:20c:29ff:fee3:884c","TLSv1.2","9750","Application Data, Application Data, Application Data, Application Data, Application Data, Application Data, Application Data, Application Data"
"146","0.991458838","142.250.75.66","192.168.1.196","TCP","74","443  >  39200 [SYN, ACK] Seq=0 Ack=1 Win=65535 Len=0 MSS=1412 SACK_PERM TSval=3508126800 TSecr=1596155327 WS=256"
"147","0.991489905","192.168.1.196","142.250.75.66","TCP","66","39200  >  443 [ACK] Seq=1 Ack=1 Win=64256 Len=0 TSval=1596155333 TSecr=3508126800"
"148","0.991776787","2a0d:6fc2:4940:600:20c:29ff:fee3:884c","2a00:1450:4028:805::2004","TCP","86","54826  >  443 [ACK] Seq=8627 Ack=121372 Win=1019 Len=0 TSval=2296236844 TSecr=2541243434"
"149","0.992199809","192.168.1.196","142.250.75.66","TLSv1.3","1864","Client Hello (SNI=www.googleadservices.com)"
"150","0.992458891","2a00:1450:4028:805::2004","2a0d:6fc2:4940:600:20c:29ff:fee3:884c","TLSv1.2","10536","Application Data, Application Data, Application Data, Application Data, Application Data, Application Data, Application Data, Application Data, Application Data"
"151","0.993507681","2a0d:6fc2:4940:600:20c:29ff:fee3:884c","2a00:1450:4028:805::2004","TCP","86","54826  >  443 [ACK] Seq=8627 Ack=131822 Win=1019 Len=0 TSval=2296236846 TSecr=2541243435"
"152","0.996005136","2a00:1450:4028:805::2004","2a0d:6fc2:4940:600:20c:29ff:fee3:884c","TLSv1.2","1294","Application Data"
"153","0.996005570","2a00:1450:4028:805::2004","2a0d:6fc2:4940:600:20c:29ff:fee3:884c","TLSv1.2","1294","Application Data"
"154","0.996005600","2a00:1450:4028:805::2004","2a0d:6fc2:4940:600:20c:29ff:fee3:884c","TLSv1.2","1294","Application Data"
"155","0.996005619","2a00:1450:4028:805::2004","2a0d:6fc2:4940:600:20c:29ff:fee3:884c","TLSv1.2","1294","Application Data"
"156","0.996005639","2a00:1450:4028:805::2004","2a0d:6fc2:4940:600:20c:29ff:fee3:884c","TLSv1.2","1294","Application Data"
"157","0.996005657","2a00:1450:4028:805::2004","2a0d:6fc2:4940:600:20c:29ff:fee3:884c","TLSv1.2","1294","Application Data"
"158","0.996005677","142.250.75.66","192.168.1.196","TCP","66","443  >  39200 [ACK] Seq=1 Ack=1401 Win=267520 Len=0 TSval=3508126806 TSecr=1596155333"
"159","0.996005696","142.250.75.66","192.168.1.196","TCP","66","443  >  39200 [ACK] Seq=1 Ack=1799 Win=267264 Len=0 TSval=3508126806 TSecr=1596155333"
"160","0.996528750","2a0d:6fc2:4940:600:20c:29ff:fee3:884c","2a00:1450:4028:805::2004","TCP","86","54826  >  443 [ACK] Seq=8627 Ack=139070 Win=1019 Len=0 TSval=2296236849 TSecr=2541243440"
"161","0.999132880","2a00:1450:4028:805::2004","2a0d:6fc2:4940:600:20c:29ff:fee3:884c","TLSv1.2","1294","Application Data"
"162","0.999133400","2a00:1450:4028:805::2004","2a0d:6fc2:4940:600:20c:29ff:fee3:884c","TLSv1.2","8542","Application Data, Application Data, Application Data, Application Data, Application Data, Application Data, Application Data"
"163","0.999161369","2a00:1450:4028:805::2004","2a0d:6fc2:4940:600:20c:29ff:fee3:884c","TLSv1.2","8054","Application Data, Application Data, Application Data, Application Data, Application Data, Application Data, Application Data, Application Data"
"164","0.999161407","2a00:1450:4028:805::2004","2a0d:6fc2:4940:600:20c:29ff:fee3:884c","TLSv1.2","125","Application Data"
"165","1.000549253","2a0d:6fc2:4940:600:20c:29ff:fee3:884c","2a00:1450:4028:805::2004","TCP","86","54826  >  443 [ACK] Seq=8627 Ack=156741 Win=894 Len=0 TSval=2296236853 TSecr=2541243441"
"166","1.002885289","2a0d:6fc2:4940:600:20c:29ff:fee3:884c","2a00:1450:4028:805::2004","TLSv1.2","125","Application Data"
"167","1.009535223","2a00:1450:4028:805::2004","2a0d:6fc2:4940:600:20c:29ff:fee3:884c","TCP","86","443  >  54826 [ACK] Seq=156741 Ack=8666 Win=1016 Len=0 TSval=2541243455 TSecr=2296236855"
"168","1.011389406","2a00:1450:4028:806::200a","2a0d:6fc2:4940:600:20c:29ff:fee3:884c","TLSv1.2","162","Application Data"
"169","1.011389744","2a00:1450:4028:806::200a","2a0d:6fc2:4940:600:20c:29ff:fee3:884c","TLSv1.2","556","Application Data"
"170","1.011827275","2a0d:6fc2:4940:600:20c:29ff:fee3:884c","2a00:1450:4028:806::200a","TCP","86","37248  >  443 [ACK] Seq=387 Ack=547 Win=599 Len=0 TSval=993043101 TSecr=1515873684"
"171","1.012257369","2a00:1450:4028:806::200a","2a0d:6fc2:4940:600:20c:29ff:fee3:884c","TLSv1.2","117","Application Data"
"172","1.012257600","2a00:1450:4028:806::200a","2a0d:6fc2:4940:600:20c:29ff:fee3:884c","TLSv1.2","125","Application Data"
"173","1.013763111","2a0d:6fc2:4940:600:20c:29ff:fee3:884c","2a00:1450:4028:806::200a","TCP","86","37248  >  443 [ACK] Seq=387 Ack=617 Win=599 Len=0 TSval=993043103 TSecr=1515873684"
"174","1.014457727","2a0d:6fc2:4940:600:20c:29ff:fee3:884c","2a00:1450:4028:806::200a","TLSv1.2","125","Application Data"
"175","1.017378447","192.168.1.196","192.168.1.1","DNS","89","Standard query 0x3462 AAAA history.google.com OPT"
"176","1.017624127","192.168.1.196","192.168.1.1","DNS","89","Standard query 0x6a49 A history.google.com OPT"
"177","1.017735071","192.168.1.196","192.168.1.1","DNS","89","Standard query 0x6665 HTTPS history.google.com OPT"
"178","1.021720321","192.168.1.1","192.168.1.196","DNS","235","Standard query response 0x3462 AAAA history.google.com CNAME history.l.google.com AAAA 2a00:1450:400c:c0c::8a AAAA 2a00:1450:400c:c0c::66 AAAA 2a00:1450:400c:c0c::64 AAAA 2a00:1450:400c:c0c::71 OPT"
"179","1.021720726","192.168.1.1","192.168.1.196","DNS","219","Standard query response 0x6a49 A history.google.com CNAME history.l.google.com A 173.194.76.101 A 173.194.76.113 A 173.194.76.139 A 173.194.76.138 A 173.194.76.102 A 173.194.76.100 OPT"
"180","1.021720744","192.168.1.1","192.168.1.196","DNS","173","Standard query response 0x6665 HTTPS history.google.com CNAME history.l.google.com SOA ns1.google.com OPT"
"181","1.021720762","2a00:1450:4028:806::200a","2a0d:6fc2:4940:600:20c:29ff:fee3:884c","TCP","86","443  >  37248 [ACK] Seq=617 Ack=426 Win=1045 Len=0 TSval=1515873690 TSecr=993043103"
"182","1.023800194","192.168.1.196","192.168.1.1","DNS","91","Standard query 0x74ea HTTPS history.l.google.com OPT"
"183","1.030316715","2a0d:6fc2:4940:600:20c:29ff:fee3:884c","2a00:1450:400c:c0c::8a","TCP","94","53576  >  443 [SYN] Seq=0 Win=64400 Len=0 MSS=1400 SACK_PERM TSval=4254120382 TSecr=0 WS=128"
"184","1.030665166","192.168.1.1","192.168.1.196","DNS","151","Standard query response 0x74ea HTTPS history.l.google.com SOA ns1.google.com OPT"
"185","1.031101276","2a00:1450:4028:804::200e","2a0d:6fc2:4940:600:20c:29ff:fee3:884c","TLSv1.3","2502","Server Hello, Change Cipher Spec"
"186","1.031126647","2a0d:6fc2:4940:600:20c:29ff:fee3:884c","2a00:1450:4028:804::200e","TCP","86","43620  >  443 [ACK] Seq=1757 Ack=2417 Win=68992 Len=0 TSval=2183852215 TSecr=2723335757"
"187","1.033982527","2a00:1450:4028:804::200e","2a0d:6fc2:4940:600:20c:29ff:fee3:884c","TCP","3710","443  >  43620 [PSH, ACK] Seq=2417 Ack=1757 Win=268288 Len=3624 TSval=2723335757 TSecr=2183852156 [TCP PDU reassembled in 188]"
"188","1.033982891","2a00:1450:4028:804::200e","2a0d:6fc2:4940:600:20c:29ff:fee3:884c","TLSv1.3","1881","Application Data"
"189","1.034089298","2a0d:6fc2:4940:600:20c:29ff:fee3:884c","2a00:1450:4028:804::200e","TCP","86","43620  >  443 [ACK] Seq=1757 Ack=6041 Win=73856 Len=0 TSval=2183852218 TSecr=2723335757"
"190","1.034209851","2a0d:6fc2:4940:600:20c:29ff:fee3:884c","2a00:1450:4028:804::200e","TCP","86","43620  >  443 [ACK] Seq=1757 Ack=7836 Win=73856 Len=0 TSval=2183852218 TSecr=2723335757"
"191","1.036519139","2a00:1450:4028:805::2004","2a0d:6fc2:4940:600:20c:29ff:fee3:884c","TLSv1.2","776","Application Data"
"192","1.036519311","2a00:1450:4028:805::2004","2a0d:6fc2:4940:600:20c:29ff:fee3:884c","TLSv1.2","1294","Application Data"
"193","1.036519344","2a00:1450:4028:805::2004","2a0d:6fc2:4940:600:20c:29ff:fee3:884c","TLSv1.2","1294","Application Data"
"194","1.036519363","2a00:1450:4028:805::2004","2a0d:6fc2:4940:600:20c:29ff:fee3:884c","TLSv1.2","1294","Application Data"
"195","1.037016760","2a0d:6fc2:4940:600:20c:29ff:fee3:884c","2a00:1450:4028:805::2004","TCP","86","54826  >  443 [ACK] Seq=8666 Ack=161055 Win=1019 Len=0 TSval=2296236889 TSecr=2541243481"
"196","1.037775426","2a00:1450:4028:805::2004","2a0d:6fc2:4940:600:20c:29ff:fee3:884c","TLSv1.2","877","Application Data"
"197","1.037775639","2a00:1450:4028:805::2004","2a0d:6fc2:4940:600:20c:29ff:fee3:884c","TLSv1.2","178","Application Data"
"198","1.037775693","2a00:1450:4028:805::2004","2a0d:6fc2:4940:600:20c:29ff:fee3:884c","TLSv1.2","1294","Application Data"
"199","1.038628113","2a00:1450:4028:805::2004","2a0d:6fc2:4940:600:20c:29ff:fee3:884c","TLSv1.2","481","Application Data"
"200","1.038628540","2a00:1450:4028:805::2004","2a0d:6fc2:4940:600:20c:29ff:fee3:884c","TLSv1.2","118","Application Data"
"201","1.038628572","2a00:1450:4028:805::2004","2a0d:6fc2:4940:600:20c:29ff:fee3:884c","TLSv1.2","117","Application Data"
"202","1.038628591","2a00:1450:4028:805::2004","2a0d:6fc2:4940:600:20c:29ff:fee3:884c","TLSv1.2","125","Application Data"
"203","1.040946665","2a0d:6fc2:4940:600:20c:29ff:fee3:884c","2a00:1450:4028:805::2004","TCP","86","54826  >  443 [ACK] Seq=8666 Ack=163643 Win=1019 Len=0 TSval=2296236893 TSecr=2541243482"
"204","1.043527399","2a0d:6fc2:4940:600:20c:29ff:fee3:884c","2a00:1450:4028:804::200e","TLSv1.3","160","Change Cipher Spec, Application Data"
"205","1.044012359","2a0d:6fc2:4940:600:20c:29ff:fee3:884c","2a00:1450:4028:805::2004","TLSv1.2","125","Application Data"
"206","1.044199656","2a0d:6fc2:4940:600:20c:29ff:fee3:884c","2a00:1450:4028:804::200e","TLSv1.3","178","Application Data"
"207","1.044387127","2a0d:6fc2:4940:600:20c:29ff:fee3:884c","2a00:1450:4028:804::200e","TCP","1474","43620  >  443 [ACK] Seq=1923 Ack=7836 Win=73856 Len=1388 TSval=2183852228 TSecr=2723335757 [TCP PDU reassembled in 208]"
"208","1.044388810","2a0d:6fc2:4940:600:20c:29ff:fee3:884c","2a00:1450:4028:804::200e","TLSv1.3","885","Application Data"
"209","1.046486037","2a00:1450:4028:804::200e","2a0d:6fc2:4940:600:20c:29ff:fee3:884c","TLSv1.3","1044","Application Data, Application Data"
"210","1.046486401","2a00:1450:4028:804::200e","2a0d:6fc2:4940:600:20c:29ff:fee3:884c","TCP","86","443  >  43620 [ACK] Seq=7836 Ack=1831 Win=268288 Len=0 TSval=2723335772 TSecr=2183852228"
"211","1.046486427","2a00:1450:4028:804::200e","2a0d:6fc2:4940:600:20c:29ff:fee3:884c","TLSv1.3","117","Application Data"
"212","1.046561561","2a0d:6fc2:4940:600:20c:29ff:fee3:884c","2a00:1450:4028:804::200e","TCP","86","43620  >  443 [ACK] Seq=4110 Ack=8825 Win=76032 Len=0 TSval=2183852231 TSecr=2723335772"
"213","1.046752854","2a0d:6fc2:4940:600:20c:29ff:fee3:884c","2a00:1450:4028:804::200e","TLSv1.3","117","Application Data"
"214","1.047071474","2a00:1450:4028:804::200e","2a0d:6fc2:4940:600:20c:29ff:fee3:884c","TCP","86","443  >  43620 [ACK] Seq=8825 Ack=4110 Win=266240 Len=0 TSval=2723335773 TSecr=2183852228"
"215","1.049144692","142.250.75.66","192.168.1.196","TLSv1.3","5447","Server Hello, Change Cipher Spec, Application Data"
"216","1.049169951","192.168.1.196","142.250.75.66","TCP","66","39200  >  443 [ACK] Seq=1799 Ack=5382 Win=74880 Len=0 TSval=1596155390 TSecr=3508126860"
"217","1.051491977","2a00:1450:4028:805::2004","2a0d:6fc2:4940:600:20c:29ff:fee3:884c","TCP","86","443  >  54826 [ACK] Seq=163643 Ack=8705 Win=1016 Len=0 TSval=2541243496 TSecr=2296236896"
"218","1.057023150","2a00:1450:4028:804::200e","2a0d:6fc2:4940:600:20c:29ff:fee3:884c","TCP","86","443  >  43620 [ACK] Seq=8825 Ack=4141 Win=266240 Len=0 TSval=2723335780 TSecr=2183852231"
"219","1.057038534","192.168.1.196","142.250.75.66","TLSv1.3","140","Change Cipher Spec, Application Data"
"220","1.057776411","192.168.1.196","142.250.75.66","TLSv1.3","158","Application Data"
"221","1.058116607","192.168.1.196","142.250.75.66","TLSv1.3","750","Application Data"
"222","1.060593195","142.250.75.66","192.168.1.196","TCP","66","443  >  39200 [ACK] Seq=5382 Ack=1873 Win=267264 Len=0 TSval=3508126871 TSecr=1596155398"
"223","1.060593471","142.250.75.66","192.168.1.196","TLSv1.3","1044","Application Data, Application Data"
"224","1.060593498","142.250.75.66","192.168.1.196","TLSv1.3","97","Application Data"
"225","1.062558349","192.168.1.196","142.250.75.66","TCP","66","39200  >  443 [ACK] Seq=2649 Ack=6391 Win=77696 Len=0 TSval=1596155404 TSecr=3508126871"
"226","1.062826233","192.168.1.196","142.250.75.66","TLSv1.3","97","Application Data"
"227","1.067023267","2a00:1450:4028:805::2004","2a0d:6fc2:4940:600:20c:29ff:fee3:884c","TLSv1.2","837","Application Data"
"228","1.067023590","2a00:1450:4028:805::2004","2a0d:6fc2:4940:600:20c:29ff:fee3:884c","TLSv1.2","117","Application Data"
"229","1.067023617","2a00:1450:4028:805::2004","2a0d:6fc2:4940:600:20c:29ff:fee3:884c","TLSv1.2","125","Application Data"
"230","1.067023636","142.250.75.66","192.168.1.196","TCP","66","443  >  39200 [ACK] Seq=6391 Ack=2649 Win=266752 Len=0 TSval=3508126876 TSecr=1596155399"
"231","1.067206864","2a0d:6fc2:4940:600:20c:29ff:fee3:884c","2a00:1450:4028:805::2004","TCP","86","54826  >  443 [ACK] Seq=8705 Ack=164464 Win=1019 Len=0 TSval=2296236919 TSecr=2541243507"
"232","1.069124458","2a0d:6fc2:4940:600:20c:29ff:fee3:884c","2a00:1450:4028:805::2004","TLSv1.2","125","Application Data"
"233","1.070889072","142.250.75.66","192.168.1.196","TCP","66","443  >  39200 [ACK] Seq=6391 Ack=2680 Win=266752 Len=0 TSval=3508126881 TSecr=1596155404"
"234","1.077589473","2a00:1450:4028:805::2004","2a0d:6fc2:4940:600:20c:29ff:fee3:884c","TCP","86","443  >  54826 [ACK] Seq=164464 Ack=8744 Win=1016 Len=0 TSval=2541243522 TSecr=2296236921"
"235","1.096219233","2a00:1450:400c:c0c::8a","2a0d:6fc2:4940:600:20c:29ff:fee3:884c","TCP","94","443  >  53576 [SYN, ACK] Seq=0 Ack=1 Win=65535 Len=0 MSS=1400 SACK_PERM TSval=366579845 TSecr=4254120382 WS=256"
"236","1.096257866","2a0d:6fc2:4940:600:20c:29ff:fee3:884c","2a00:1450:400c:c0c::8a","TCP","86","53576  >  443 [ACK] Seq=1 Ack=1 Win=64512 Len=0 TSval=4254120448 TSecr=366579845"
"237","1.096881585","2a0d:6fc2:4940:600:20c:29ff:fee3:884c","2a00:1450:400c:c0c::8a","TCP","1474","53576  >  443 [ACK] Seq=1 Ack=1 Win=64512 Len=1388 TSval=4254120449 TSecr=366579845 [TCP PDU reassembled in 238]"
"238","1.096886235","2a0d:6fc2:4940:600:20c:29ff:fee3:884c","2a00:1450:400c:c0c::8a","TLSv1.3","426","Client Hello (SNI=history.google.com)"
"239","1.119232007","192.168.1.196","192.168.1.1","DNS","84","Standard query 0xeaa2 AAAA id.google.com OPT"
"240","1.119630477","192.168.1.196","192.168.1.1","DNS","84","Standard query 0x1e83 A id.google.com OPT"
"241","1.119839668","2a00:1450:4028:804::200e","2a0d:6fc2:4940:600:20c:29ff:fee3:884c","TLSv1.3","125","[TCP Previous segment not captured] , Application Data"
"242","1.119839927","2a00:1450:4028:804::200e","2a0d:6fc2:4940:600:20c:29ff:fee3:884c","TCP","1294","[TCP Out-Of-Order] 443  >  43620 [PSH, ACK] Seq=8825 Ack=4141 Win=266240 Len=1208 TSval=2723335844 TSecr=2183852231"
"243","1.119839953","2a00:1450:4028:804::200e","2a0d:6fc2:4940:600:20c:29ff:fee3:884c","TCP","275","[TCP Out-Of-Order] 443  >  43620 [PSH, ACK] Seq=10033 Ack=4141 Win=266240 Len=189 TSval=2723335844 TSecr=2183852231"
"244","1.119839978","2a00:1450:4028:804::200e","2a0d:6fc2:4940:600:20c:29ff:fee3:884c","TCP","1294","[TCP Out-Of-Order] 443  >  43620 [PSH, ACK] Seq=10222 Ack=4141 Win=266240 Len=1208 TSval=2723335844 TSecr=2183852231"
"245","1.119840074","2a00:1450:4028:804::200e","2a0d:6fc2:4940:600:20c:29ff:fee3:884c","TCP","583","[TCP Out-Of-Order] 443  >  43620 [PSH, ACK] Seq=11430 Ack=4141 Win=266240 Len=497 TSval=2723335844 TSecr=2183852231"
"246","1.119840123","2a00:1450:4028:804::200e","2a0d:6fc2:4940:600:20c:29ff:fee3:884c","TCP","117","[TCP Out-Of-Order] 443  >  43620 [PSH, ACK] Seq=11927 Ack=4141 Win=266240 Len=31 TSval=2723335844 TSecr=2183852231"
"247","1.119864112","2a0d:6fc2:4940:600:20c:29ff:fee3:884c","2a00:1450:4028:804::200e","TCP","98","[TCP Dup ACK 212#1] 43620  >  443 [ACK] Seq=4141 Ack=8825 Win=76672 Len=0 TSval=2183852304 TSecr=2723335780 SLE=11958 SRE=11997"
"248","1.119969603","2a0d:6fc2:4940:600:20c:29ff:fee3:884c","2a00:1450:4028:804::200e","TCP","98","43620  >  443 [ACK] Seq=4141 Ack=10033 Win=75520 Len=0 TSval=2183852304 TSecr=2723335844 SLE=11958 SRE=11997"
"249","1.120040485","2a0d:6fc2:4940:600:20c:29ff:fee3:884c","2a00:1450:4028:804::200e","TCP","98","43620  >  443 [ACK] Seq=4141 Ack=10222 Win=75392 Len=0 TSval=2183852304 TSecr=2723335844 SLE=11958 SRE=11997"
"250","1.120116790","2a0d:6fc2:4940:600:20c:29ff:fee3:884c","2a00:1450:4028:804::200e","TCP","98","43620  >  443 [ACK] Seq=4141 Ack=11430 Win=74240 Len=0 TSval=2183852304 TSecr=2723335844 SLE=11958 SRE=11997"
"251","1.120187186","2a0d:6fc2:4940:600:20c:29ff:fee3:884c","2a00:1450:4028:804::200e","TCP","98","43620  >  443 [ACK] Seq=4141 Ack=11927 Win=73856 Len=0 TSval=2183852304 TSecr=2723335844 SLE=11958 SRE=11997"
"252","1.120270725","2a0d:6fc2:4940:600:20c:29ff:fee3:884c","2a00:1450:4028:804::200e","TCP","86","43620  >  443 [ACK] Seq=4141 Ack=11997 Win=73856 Len=0 TSval=2183852304 TSecr=2723335844"
"253","1.120360594","192.168.1.196","192.168.1.1","DNS","84","Standard query 0x8879 HTTPS id.google.com OPT"
"254","1.120565714","142.250.75.66","192.168.1.196","TLSv1.3","446","Application Data"
"255","1.120565818","142.250.75.66","192.168.1.196","TLSv1.3","97","Application Data"
"256","1.120565853","142.250.75.66","192.168.1.196","TLSv1.3","105","Application Data"
"257","1.121186265","192.168.1.196","142.250.75.66","TCP","66","39200  >  443 [ACK] Seq=2680 Ack=6841 Win=80512 Len=0 TSval=1596155462 TSecr=3508126930"
"258","1.125540559","2a0d:6fc2:4940:600:20c:29ff:fee3:884c","2a00:1450:4028:804::200e","TLSv1.3","125","Application Data"
"259","1.125799881","2a0d:6fc2:4940:600:20c:29ff:fee3:884c","2a00:1450:4028:804::200e","TLSv1.3","121","Application Data"
"260","1.125898886","192.168.1.196","142.250.75.66","TLSv1.3","105","Application Data"
"261","1.127154929","2a0d:6fc2:4940:600:20c:29ff:fee3:884c","2a00:1450:4028:805::2004","TCP","1474","54826  >  443 [ACK] Seq=8744 Ack=164464 Win=1019 Len=1388 TSval=2296236979 TSecr=2541243522 [TCP PDU reassembled in 262]"
"262","1.127158051","2a0d:6fc2:4940:600:20c:29ff:fee3:884c","2a00:1450:4028:805::2004","TLSv1.2","1354","Application Data"
