"No.","Time","Source","Destination","Protocol","Length","Info"
"1","0.000000000","192.168.1.196","151.101.194.91","TCP","66","47522  >  443 [ACK] Seq=1 Ack=1 Win=654 Len=0 TSval=2416773423 TSecr=891893797"
"2","0.058851898","151.101.194.91","192.168.1.196","TCP","66","[TCP ACKed unseen segment] 443  >  47522 [ACK] Seq=1 Ack=2 Win=287 Len=0 TSval=891904019 TSecr=2416753204"
"3","0.512149706","2a0d:6fc2:4940:600:20c:29ff:fee3:884c","2001:40a8:4400:3::5266:982a","TCP","86","48670  >  80 [ACK] Seq=1 Ack=1 Win=486 Len=0 TSval=3896210208 TSecr=1904690191"
"4","0.515079408","2001:40a8:4400:3::5266:982a","2a0d:6fc2:4940:600:20c:29ff:fee3:884c","TCP","86","[TCP ACKed unseen segment] 80  >  48670 [ACK] Seq=1 Ack=2 Win=501 Len=0 TSval=1904700431 TSecr=3896138586"
"5","0.964439221","192.168.1.196","192.168.1.1","DNS","86","Standard query 0x5d6c A www.spotify.com OPT"
"6","0.964841566","192.168.1.196","192.168.1.1","DNS","86","Standard query 0x3b59 AAAA www.spotify.com OPT"
"7","0.970686906","192.168.1.1","192.168.1.196","DNS","146","Standard query response 0x5d6c A www.spotify.com CNAME edge-web.dual-gslb.spotify.com A 35.186.224.24 OPT"
"8","0.970687133","192.168.1.1","192.168.1.196","DNS","158","Standard query response 0x3b59 AAAA www.spotify.com CNAME edge-web.dual-gslb.spotify.com AAAA 2600:1901:1:7c5:: OPT"
"9","0.975094424","2a0d:6fc2:4940:600:20c:29ff:fee3:884c","2600:1901:1:7c5::","TCP","1474","37126  >  443 [ACK] Seq=1 Ack=1 Win=502 Len=1388 TSval=1245605906 TSecr=1584496838 [TCP PDU reassembled in 10]"
"10","0.975101424","2a0d:6fc2:4940:600:20c:29ff:fee3:884c","2600:1901:1:7c5::","TLSv1.2","1218","Application Data"
"11","0.979696377","2600:1901:1:7c5::","2a0d:6fc2:4940:600:20c:29ff:fee3:884c","TCP","86","443  >  37126 [ACK] Seq=1 Ack=1389 Win=977 Len=0 TSval=1584507830 TSecr=1245605906"
"12","0.979696896","2600:1901:1:7c5::","2a0d:6fc2:4940:600:20c:29ff:fee3:884c","TCP","86","443  >  37126 [ACK] Seq=1 Ack=2521 Win=973 Len=0 TSval=1584507830 TSecr=1245605906"
"13","1.070664613","2600:1901:1:7c5::","2a0d:6fc2:4940:600:20c:29ff:fee3:884c","TLSv1.2","182","Application Data"
"14","1.070665007","2600:1901:1:7c5::","2a0d:6fc2:4940:600:20c:29ff:fee3:884c","TLSv1.2","1038","Application Data"
"15","1.071301845","2a0d:6fc2:4940:600:20c:29ff:fee3:884c","2600:1901:1:7c5::","TCP","86","37126  >  443 [ACK] Seq=2521 Ack=1049 Win=502 Len=0 TSval=1245606002 TSecr=1584507922"
"16","1.073238395","2600:1901:1:7c5::","2a0d:6fc2:4940:600:20c:29ff:fee3:884c","TLSv1.2","937","Application Data"
"17","1.073238504","2600:1901:1:7c5::","2a0d:6fc2:4940:600:20c:29ff:fee3:884c","TLSv1.2","132","Application Data"
"18","1.073694403","2a0d:6fc2:4940:600:20c:29ff:fee3:884c","2600:1901:1:7c5::","TCP","86","37126  >  443 [ACK] Seq=2521 Ack=1946 Win=502 Len=0 TSval=1245606004 TSecr=1584507922"
"19","1.073852875","2a0d:6fc2:4940:600:20c:29ff:fee3:884c","2600:1901:1:7c5::","TLSv1.2","132","Application Data"
"20","1.076792385","2600:1901:1:7c5::","2a0d:6fc2:4940:600:20c:29ff:fee3:884c","TCP","86","443  >  37126 [ACK] Seq=1946 Ack=2567 Win=973 Len=0 TSval=1584507929 TSecr=1245606004"
"21","1.904770167","TechnicolorD_33:6b:a2","Broadcast","ARP","60","Who has 192.168.1.149? Tell 192.168.1.1"
"22","1.904770539","TechnicolorD_33:6b:a2","Broadcast","ARP","60","Who has 192.168.1.161? Tell 192.168.1.1"
"23","1.904770586","TechnicolorD_33:6b:a2","Broadcast","ARP","60","Who has 192.168.1.189? Tell 192.168.1.1"
"24","2.006258345","TechnicolorD_33:6b:a2","Broadcast","ARP","60","Who has 192.168.1.197? Tell 192.168.1.1"
"25","3.072028534","2a0d:6fc2:4940:600:20c:29ff:fee3:884c","2a00:1450:4028:804::2003","TCP","86","54174  >  80 [ACK] Seq=1 Ack=1 Win=499 Len=0 TSval=2449267816 TSecr=2310329674"
"26","3.072175967","2a0d:6fc2:4940:600:20c:29ff:fee3:884c","2a00:1450:4028:804::2003","TCP","86","54164  >  80 [ACK] Seq=1 Ack=1 Win=494 Len=0 TSval=2449267816 TSecr=2310329674"
"27","3.077204247","2a00:1450:4028:804::2003","2a0d:6fc2:4940:600:20c:29ff:fee3:884c","TCP","86","[TCP ACKed unseen segment] 80  >  54174 [ACK] Seq=1 Ack=2 Win=1053 Len=0 TSval=2310339914 TSecr=2449196427"
"28","3.077204513","2a00:1450:4028:804::2003","2a0d:6fc2:4940:600:20c:29ff:fee3:884c","TCP","86","[TCP ACKed unseen segment] 80  >  54164 [ACK] Seq=1 Ack=2 Win=1052 Len=0 TSval=2310339914 TSecr=2449196468"
"29","3.421802943","2a0d:6fc2:4940:600:20c:29ff:fee3:884c","2600:1901:1:5a5::","TLSv1.2","526","Application Data"
"30","3.422060476","2a0d:6fc2:4940:600:20c:29ff:fee3:884c","2600:1901:1:5a5::","TLSv1.2","455","Application Data"
"31","3.425199812","2600:1901:1:5a5::","2a0d:6fc2:4940:600:20c:29ff:fee3:884c","TCP","86","443  >  54170 [ACK] Seq=1 Ack=441 Win=543 Len=0 TSval=2565759500 TSecr=1096303596"
"32","3.425200000","2600:1901:1:5a5::","2a0d:6fc2:4940:600:20c:29ff:fee3:884c","TCP","86","443  >  54170 [ACK] Seq=1 Ack=810 Win=542 Len=0 TSval=2565759501 TSecr=1096303597"
"33","3.580444358","2600:1901:1:5a5::","2a0d:6fc2:4940:600:20c:29ff:fee3:884c","TLSv1.2","167","Application Data"
"34","3.580444633","2600:1901:1:5a5::","2a0d:6fc2:4940:600:20c:29ff:fee3:884c","TLSv1.2","1294","Application Data"
"35","3.581165549","2a0d:6fc2:4940:600:20c:29ff:fee3:884c","2600:1901:1:5a5::","TCP","86","54170  >  443 [ACK] Seq=810 Ack=1290 Win=500 Len=0 TSval=1096303756 TSecr=2565759654"
"36","3.582801859","2600:1901:1:5a5::","2a0d:6fc2:4940:600:20c:29ff:fee3:884c","TLSv1.2","877","Application Data"
"37","3.584984477","2a0d:6fc2:4940:600:20c:29ff:fee3:884c","2a04:4e42:8e::760","TCP","86","34350  >  443 [ACK] Seq=1 Ack=1 Win=640 Len=0 TSval=2810427161 TSecr=1918188458"
"38","3.587909522","2600:1901:1:5a5::","2a0d:6fc2:4940:600:20c:29ff:fee3:884c","TLSv1.2","949","Application Data"
"39","3.587909801","2600:1901:1:5a5::","2a0d:6fc2:4940:600:20c:29ff:fee3:884c","TLSv1.2","132","Application Data"
"40","3.587931675","2a0d:6fc2:4940:600:20c:29ff:fee3:884c","2600:1901:1:5a5::","TCP","86","54170  >  443 [ACK] Seq=810 Ack=2944 Win=502 Len=0 TSval=1096303762 TSecr=2565759654"
"41","3.588233596","2a0d:6fc2:4940:600:20c:29ff:fee3:884c","2600:1901:1:5a5::","TLSv1.2","132","Application Data"
"42","3.594119809","2600:1901:1:5a5::","2a0d:6fc2:4940:600:20c:29ff:fee3:884c","TCP","86","443  >  54170 [ACK] Seq=2990 Ack=856 Win=544 Len=0 TSval=2565759667 TSecr=1096303763"
"43","3.627823419","2600:1901:1:194::","2a0d:6fc2:4940:600:20c:29ff:fee3:884c","TLSv1.2","1294","Application Data"
"44","3.627823757","2600:1901:1:194::","2a0d:6fc2:4940:600:20c:29ff:fee3:884c","TLSv1.2","1294","Application Data"
"45","3.627823776","2600:1901:1:194::","2a0d:6fc2:4940:600:20c:29ff:fee3:884c","TLSv1.2","1294","Application Data"
"46","3.627852391","2a0d:6fc2:4940:600:20c:29ff:fee3:884c","2600:1901:1:194::","TCP","86","57800  >  443 [ACK] Seq=1 Ack=1209 Win=1705 Len=0 TSval=46863489 TSecr=238610559"
"47","3.627946472","2a0d:6fc2:4940:600:20c:29ff:fee3:884c","2600:1901:1:194::","TCP","86","57800  >  443 [ACK] Seq=1 Ack=2417 Win=1727 Len=0 TSval=46863489 TSecr=238610559"
"48","3.627989433","2a0d:6fc2:4940:600:20c:29ff:fee3:884c","2600:1901:1:194::","TCP","86","57800  >  443 [ACK] Seq=1 Ack=3625 Win=1749 Len=0 TSval=46863490 TSecr=238610559"
"49","3.629491645","2600:1901:1:194::","2a0d:6fc2:4940:600:20c:29ff:fee3:884c","TLSv1.2","3710","Application Data, Application Data, Application Data"
"50","3.629491824","2600:1901:1:194::","2a0d:6fc2:4940:600:20c:29ff:fee3:884c","TLSv1.2","6126","Application Data, Application Data, Application Data, Application Data, Application Data"
"51","3.629506906","2a0d:6fc2:4940:600:20c:29ff:fee3:884c","2600:1901:1:194::","TCP","86","57800  >  443 [ACK] Seq=1 Ack=7249 Win=1805 Len=0 TSval=46863491 TSecr=238610559"
"52","3.629576583","2a0d:6fc2:4940:600:20c:29ff:fee3:884c","2600:1901:1:194::","TCP","86","57800  >  443 [ACK] Seq=1 Ack=13289 Win=1900 Len=0 TSval=46863491 TSecr=238610560"
"53","3.638084816","2600:1901:1:194::","2a0d:6fc2:4940:600:20c:29ff:fee3:884c","TLSv1.2","1226","Application Data"
"54","3.638085080","2600:1901:1:194::","2a0d:6fc2:4940:600:20c:29ff:fee3:884c","TLSv1.2","1294","Application Data"
"55","3.638085112","2600:1901:1:194::","2a0d:6fc2:4940:600:20c:29ff:fee3:884c","TLSv1.2","1294","Application Data"
"56","3.638085131","2600:1901:1:194::","2a0d:6fc2:4940:600:20c:29ff:fee3:884c","TLSv1.2","1294","Application Data"
"57","3.638085148","2600:1901:1:194::","2a0d:6fc2:4940:600:20c:29ff:fee3:884c","TLSv1.2","3710","Application Data, Application Data, Application Data"
"58","3.638110753","2a0d:6fc2:4940:600:20c:29ff:fee3:884c","2600:1901:1:194::","TCP","86","57800  >  443 [ACK] Seq=1 Ack=14429 Win=1919 Len=0 TSval=46863500 TSecr=238610560"
"59","3.638200206","2a0d:6fc2:4940:600:20c:29ff:fee3:884c","2600:1901:1:194::","TCP","86","57800  >  443 [ACK] Seq=1 Ack=15637 Win=1940 Len=0 TSval=46863500 TSecr=238610568"
"60","3.638234484","2a0d:6fc2:4940:600:20c:29ff:fee3:884c","2600:1901:1:194::","TCP","86","57800  >  443 [ACK] Seq=1 Ack=21677 Win=2038 Len=0 TSval=46863500 TSecr=238610568"
"61","3.641513744","2600:1901:1:194::","2a0d:6fc2:4940:600:20c:29ff:fee3:884c","TLSv1.2","1924","Application Data, Application Data"
"62","3.641531279","2a0d:6fc2:4940:600:20c:29ff:fee3:884c","2600:1901:1:194::","TCP","86","57800  >  443 [ACK] Seq=1 Ack=23515 Win=2066 Len=0 TSval=46863503 TSecr=238610569"
"63","3.644844538","2a04:4e42:8e::760","2a0d:6fc2:4940:600:20c:29ff:fee3:884c","TCP","86","[TCP ACKed unseen segment] 443  >  34350 [ACK] Seq=1 Ack=2 Win=284 Len=0 TSval=1918198699 TSecr=2810406870"
"64","4.191903635","2a0d:6fc2:4940:600:20c:29ff:fee3:884c","2600:1901:1:5a5::","TLSv1.2","531","Application Data"
"65","4.192162408","2a0d:6fc2:4940:600:20c:29ff:fee3:884c","2600:1901:1:5a5::","TLSv1.2","464","Application Data"
"66","4.194616206","2600:1901:1:5a5::","2a0d:6fc2:4940:600:20c:29ff:fee3:884c","TCP","86","443  >  54170 [ACK] Seq=2990 Ack=1301 Win=543 Len=0 TSval=2565760270 TSecr=1096304366"
"67","4.194917275","2600:1901:1:5a5::","2a0d:6fc2:4940:600:20c:29ff:fee3:884c","TCP","86","443  >  54170 [ACK] Seq=2990 Ack=1679 Win=542 Len=0 TSval=2565760271 TSecr=1096304367"
"68","4.348171113","2600:1901:1:5a5::","2a0d:6fc2:4940:600:20c:29ff:fee3:884c","TLSv1.2","167","Application Data"
"69","4.348172006","2600:1901:1:5a5::","2a0d:6fc2:4940:600:20c:29ff:fee3:884c","TLSv1.2","1294","Application Data"
"70","4.348172071","2600:1901:1:5a5::","2a0d:6fc2:4940:600:20c:29ff:fee3:884c","TLSv1.2","857","Application Data"
"71","4.348375558","2a0d:6fc2:4940:600:20c:29ff:fee3:884c","2600:1901:1:5a5::","TCP","86","54170  >  443 [ACK] Seq=1679 Ack=5050 Win=502 Len=0 TSval=1096304523 TSecr=2565760423"
"72","4.354888972","2600:1901:1:5a5::","2a0d:6fc2:4940:600:20c:29ff:fee3:884c","TLSv1.2","959","Application Data"
"73","4.354889211","2600:1901:1:5a5::","2a0d:6fc2:4940:600:20c:29ff:fee3:884c","TLSv1.2","132","Application Data"
"74","4.355339811","2a0d:6fc2:4940:600:20c:29ff:fee3:884c","2600:1901:1:5a5::","TCP","86","54170  >  443 [ACK] Seq=1679 Ack=5969 Win=521 Len=0 TSval=1096304530 TSecr=2565760423"
"75","4.355503908","2a0d:6fc2:4940:600:20c:29ff:fee3:884c","2600:1901:1:5a5::","TLSv1.2","132","Application Data"
"76","4.358835744","2600:1901:1:5a5::","2a0d:6fc2:4940:600:20c:29ff:fee3:884c","TCP","86","443  >  54170 [ACK] Seq=5969 Ack=1725 Win=544 Len=0 TSval=2565760434 TSecr=1096304530"
"77","4.381876090","2600:1901:1:194::","2a0d:6fc2:4940:600:20c:29ff:fee3:884c","TLSv1.2","1294","Application Data"
"78","4.381876388","2600:1901:1:194::","2a0d:6fc2:4940:600:20c:29ff:fee3:884c","TLSv1.2","1294","Application Data"
"79","4.381903149","2a0d:6fc2:4940:600:20c:29ff:fee3:884c","2600:1901:1:194::","TCP","86","57800  >  443 [ACK] Seq=1 Ack=24723 Win=2088 Len=0 TSval=46864243 TSecr=238611312"
"80","4.382019458","2a0d:6fc2:4940:600:20c:29ff:fee3:884c","2600:1901:1:194::","TCP","86","57800  >  443 [ACK] Seq=1 Ack=25931 Win=2110 Len=0 TSval=46864244 TSecr=238611312"
"81","4.382857344","2600:1901:1:194::","2a0d:6fc2:4940:600:20c:29ff:fee3:884c","TLSv1.2","573","Application Data"
"82","4.382886890","2a0d:6fc2:4940:600:20c:29ff:fee3:884c","2600:1901:1:194::","TCP","86","57800  >  443 [ACK] Seq=1 Ack=26418 Win=2128 Len=0 TSval=46864244 TSecr=238611312"
"83","4.391333081","2600:1901:1:194::","2a0d:6fc2:4940:600:20c:29ff:fee3:884c","TLSv1.2","1294","Application Data"
"84","4.391333257","2600:1901:1:194::","2a0d:6fc2:4940:600:20c:29ff:fee3:884c","TLSv1.2","1294","Application Data"
"85","4.391360603","2a0d:6fc2:4940:600:20c:29ff:fee3:884c","2600:1901:1:194::","TCP","86","57800  >  443 [ACK] Seq=1 Ack=27626 Win=2150 Len=0 TSval=46864253 TSecr=238611319"
"86","4.391540500","2a0d:6fc2:4940:600:20c:29ff:fee3:884c","2600:1901:1:194::","TCP","86","57800  >  443 [ACK] Seq=1 Ack=28834 Win=2172 Len=0 TSval=46864253 TSecr=238611319"
"87","4.398440497","2600:1901:1:194::","2a0d:6fc2:4940:600:20c:29ff:fee3:884c","TLSv1.2","1294","Application Data"
"88","4.398440899","2600:1901:1:194::","2a0d:6fc2:4940:600:20c:29ff:fee3:884c","TLSv1.2","3710","Application Data, Application Data, Application Data"
"89","4.398440932","2600:1901:1:194::","2a0d:6fc2:4940:600:20c:29ff:fee3:884c","TLSv1.2","4392","Application Data, Application Data, Application Data, Application Data"
"90","4.398625001","2a0d:6fc2:4940:600:20c:29ff:fee3:884c","2600:1901:1:194::","TCP","86","57800  >  443 [ACK] Seq=1 Ack=30042 Win=2194 Len=0 TSval=46864260 TSecr=238611319"
"91","4.398877654","2a0d:6fc2:4940:600:20c:29ff:fee3:884c","2600:1901:1:194::","TCP","86","57800  >  443 [ACK] Seq=1 Ack=33666 Win=2250 Len=0 TSval=46864260 TSecr=238611319"
"92","4.398928400","2a0d:6fc2:4940:600:20c:29ff:fee3:884c","2600:1901:1:194::","TCP","86","57800  >  443 [ACK] Seq=1 Ack=37972 Win=2317 Len=0 TSval=46864260 TSecr=238611320"
"93","4.398933464","2600:1901:1:194::","2a0d:6fc2:4940:600:20c:29ff:fee3:884c","TLSv1.2","1294","Application Data"
"94","4.398933539","2600:1901:1:194::","2a0d:6fc2:4940:600:20c:29ff:fee3:884c","TLSv1.2","1294","Application Data"
"95","4.398933572","2600:1901:1:194::","2a0d:6fc2:4940:600:20c:29ff:fee3:884c","TLSv1.2","1294","Application Data"
"96","4.399196937","2a0d:6fc2:4940:600:20c:29ff:fee3:884c","2600:1901:1:194::","TCP","86","57800  >  443 [ACK] Seq=1 Ack=39180 Win=2339 Len=0 TSval=46864261 TSecr=238611328"
"97","4.399226944","2a0d:6fc2:4940:600:20c:29ff:fee3:884c","2600:1901:1:194::","TCP","86","57800  >  443 [ACK] Seq=1 Ack=40388 Win=2361 Len=0 TSval=46864261 TSecr=238611328"
"98","4.399254886","2a0d:6fc2:4940:600:20c:29ff:fee3:884c","2600:1901:1:194::","TCP","86","57800  >  443 [ACK] Seq=1 Ack=41596 Win=2383 Len=0 TSval=46864261 TSecr=238611329"
"99","4.400407226","2600:1901:1:194::","2a0d:6fc2:4940:600:20c:29ff:fee3:884c","TLSv1.2","3710","Application Data, Application Data, Application Data"
"100","4.400434156","2a0d:6fc2:4940:600:20c:29ff:fee3:884c","2600:1901:1:194::","TCP","86","57800  >  443 [ACK] Seq=1 Ack=45220 Win=2439 Len=0 TSval=46864262 TSecr=238611329"
"101","4.400599792","2600:1901:1:194::","2a0d:6fc2:4940:600:20c:29ff:fee3:884c","TLSv1.2","1924","Application Data, Application Data"
"102","4.400604244","2a0d:6fc2:4940:600:20c:29ff:fee3:884c","2600:1901:1:194::","TCP","86","57800  >  443 [ACK] Seq=1 Ack=47058 Win=2468 Len=0 TSval=46864262 TSecr=238611329"
"103","4.667956515","192.168.1.1","224.0.0.1","IGMPv3","60","Membership Query, general"
"104","4.979060429","TechnicolorD_33:6b:a2","Broadcast","ARP","60","Who has 192.168.1.196? Tell 192.168.1.1"
"105","4.979075924","VMware_e3:88:4c","TechnicolorD_33:6b:a2","ARP","42","192.168.1.196 is at 00:0c:29:e3:88:4c"
"106","5.049498769","192.168.1.149","224.0.0.22","IGMPv3","60","Membership Report / Join group 224.0.0.252 for any sources"
"107","5.139986563","2a0d:6fc2:4940:600:20c:29ff:fee3:884c","2001:40a8:4400:3::5266:982a","TCP","86","51538  >  443 [ACK] Seq=1 Ack=1 Win=3556 Len=0 TSval=3896214836 TSecr=1904694672"
"108","5.142199241","2001:40a8:4400:3::5266:982a","2a0d:6fc2:4940:600:20c:29ff:fee3:884c","TCP","86","[TCP ACKed unseen segment] 443  >  51538 [ACK] Seq=1 Ack=2 Win=501 Len=0 TSval=1904705058 TSecr=3896194393"
"109","5.513142780","192.168.1.149","224.0.0.251","MDNS","85","Standard query 0x0000 PTR _microsoft_mcc._tcp.local, ""QU"" question"
"110","5.514722808","fe80::8a2d:1ab:f935:f395","ff02::fb","MDNS","105","Standard query 0x0000 PTR _microsoft_mcc._tcp.local, ""QU"" question"
"111","5.547068038","192.168.1.149","224.0.0.22","IGMPv3","60","Membership Report / Join group 224.0.0.251 for any sources"
"112","5.647071426","192.168.1.196","34.107.221.82","TCP","66","51110  >  80 [ACK] Seq=1 Ack=1 Win=501 Len=0 TSval=893316536 TSecr=3536502123"
"113","5.652500385","2a0d:6fc2:4940:600:20c:29ff:fee3:884c","2600:1901:0:38d7::","TCP","86","35418  >  80 [ACK] Seq=1 Ack=1 Win=502 Len=0 TSval=1478898990 TSecr=2316922926"
"114","5.652602611","2a0d:6fc2:4940:600:20c:29ff:fee3:884c","2600:1901:0:38d7::","TCP","86","35412  >  80 [ACK] Seq=1 Ack=1 Win=502 Len=0 TSval=1478898990 TSecr=2801499607"
"115","5.655537550","2600:1901:0:38d7::","2a0d:6fc2:4940:600:20c:29ff:fee3:884c","TCP","86","[TCP ACKed unseen segment] 80  >  35418 [ACK] Seq=1 Ack=2 Win=1052 Len=0 TSval=2316933186 TSecr=1478878333"
"116","5.656918916","34.107.221.82","192.168.1.196","TCP","66","[TCP ACKed unseen segment] 80  >  51110 [ACK] Seq=1 Ack=2 Win=1050 Len=0 TSval=3536512383 TSecr=893295884"
"117","5.656919091","2600:1901:0:38d7::","2a0d:6fc2:4940:600:20c:29ff:fee3:884c","TCP","86","[TCP ACKed unseen segment] 80  >  35412 [ACK] Seq=1 Ack=2 Win=1053 Len=0 TSval=2801509867 TSecr=1478878324"
"118","6.518491356","192.168.1.149","224.0.0.251","MDNS","85","Standard query 0x0000 PTR _microsoft_mcc._tcp.local, ""QM"" question"
"119","6.518491626","fe80::8a2d:1ab:f935:f395","ff02::fb","MDNS","105","Standard query 0x0000 PTR _microsoft_mcc._tcp.local, ""QM"" question"
"120","6.846577987","2a0d:6fc2:4940:600:20c:29ff:fee3:884c","2600:1901:1:194::","TLSv1.2","136","Application Data"
"121","6.851341627","2600:1901:1:194::","2a0d:6fc2:4940:600:20c:29ff:fee3:884c","TCP","86","443  >  57800 [ACK] Seq=47058 Ack=51 Win=1039 Len=0 TSval=238613782 TSecr=46866708"
"122","6.904076837","2600:1901:1:194::","2a0d:6fc2:4940:600:20c:29ff:fee3:884c","TLSv1.2","133","Application Data"
"123","6.904113520","2a0d:6fc2:4940:600:20c:29ff:fee3:884c","2600:1901:1:194::","TCP","86","57800  >  443 [ACK] Seq=51 Ack=47105 Win=2468 Len=0 TSval=46866766 TSecr=238613835"
"124","7.060677395","192.168.1.196","192.168.1.1","DNS","94","Standard query 0x5379 AAAA o22381.ingest.sentry.io OPT"
"125","7.062553781","192.168.1.1","192.168.1.196","DNS","94","Standard query response 0x5379 AAAA o22381.ingest.sentry.io OPT"
"126","7.130842799","2a0d:6fc2:4940:600:20c:29ff:fee3:884c","2600:1901:1:5a5::","TLSv1.2","502","Application Data"
"127","7.131243318","2a0d:6fc2:4940:600:20c:29ff:fee3:884c","2600:1901:1:5a5::","TLSv1.2","920","Application Data"
"128","7.131532600","2a0d:6fc2:4940:600:20c:29ff:fee3:884c","2600:1901:1:5a5::","TCP","1474","54170  >  443 [ACK] Seq=2975 Ack=5969 Win=521 Len=1388 TSval=1096307306 TSecr=2565760434 [TCP PDU reassembled in 131]"
"129","7.131533909","2a0d:6fc2:4940:600:20c:29ff:fee3:884c","2600:1901:1:5a5::","TCP","1474","54170  >  443 [ACK] Seq=4363 Ack=5969 Win=521 Len=1388 TSval=1096307306 TSecr=2565760434 [TCP PDU reassembled in 131]"
"130","7.131534217","2a0d:6fc2:4940:600:20c:29ff:fee3:884c","2600:1901:1:5a5::","TCP","1474","54170  >  443 [ACK] Seq=5751 Ack=5969 Win=521 Len=1388 TSval=1096307306 TSecr=2565760434 [TCP PDU reassembled in 131]"
"131","7.131534483","2a0d:6fc2:4940:600:20c:29ff:fee3:884c","2600:1901:1:5a5::","TLSv1.2","269","Application Data"
"132","7.133651076","2600:1901:1:5a5::","2a0d:6fc2:4940:600:20c:29ff:fee3:884c","TCP","86","443  >  54170 [ACK] Seq=5969 Ack=2141 Win=543 Len=0 TSval=2565763209 TSecr=1096307305"
"133","7.134044615","2600:1901:1:5a5::","2a0d:6fc2:4940:600:20c:29ff:fee3:884c","TCP","86","443  >  54170 [ACK] Seq=5969 Ack=2975 Win=540 Len=0 TSval=2565763210 TSecr=1096307306"
"134","7.134979588","2600:1901:1:5a5::","2a0d:6fc2:4940:600:20c:29ff:fee3:884c","TCP","86","443  >  54170 [ACK] Seq=5969 Ack=4363 Win=535 Len=0 TSval=2565763210 TSecr=1096307306"
"135","7.134979852","2600:1901:1:5a5::","2a0d:6fc2:4940:600:20c:29ff:fee3:884c","TCP","86","443  >  54170 [ACK] Seq=5969 Ack=5751 Win=531 Len=0 TSval=2565763210 TSecr=1096307306"
"136","7.134979872","2600:1901:1:5a5::","2a0d:6fc2:4940:600:20c:29ff:fee3:884c","TCP","86","443  >  54170 [ACK] Seq=5969 Ack=7139 Win=527 Len=0 TSval=2565763210 TSecr=1096307306"
"137","7.134979891","2600:1901:1:5a5::","2a0d:6fc2:4940:600:20c:29ff:fee3:884c","TCP","86","443  >  54170 [ACK] Seq=5969 Ack=7322 Win=527 Len=0 TSval=2565763210 TSecr=1096307306"
"138","7.168064646","192.168.1.196","146.75.122.91","TCP","66","33686  >  443 [ACK] Seq=1 Ack=1 Win=691 Len=0 TSval=3772692597 TSecr=3529895772"
"139","7.168208374","2a0d:6fc2:4940:600:20c:29ff:fee3:884c","2001:40a8:4400:3::5266:985a","TCP","86","58846  >  80 [ACK] Seq=1 Ack=1 Win=498 Len=0 TSval=2574816698 TSecr=3864957444"
"140","7.168257993","2a0d:6fc2:4940:600:20c:29ff:fee3:884c","2001:40a8:4400:3::5266:985a","TCP","86","58862  >  80 [ACK] Seq=1 Ack=1 Win=498 Len=0 TSval=2574816698 TSecr=3864957444"
"141","7.168283468","2a0d:6fc2:4940:600:20c:29ff:fee3:884c","2a04:4e42:8e::760","TCP","86","50056  >  443 [ACK] Seq=1 Ack=1 Win=671 Len=0 TSval=2810430744 TSecr=1023976077"
"142","7.170970488","2001:40a8:4400:3::5266:985a","2a0d:6fc2:4940:600:20c:29ff:fee3:884c","TCP","86","[TCP ACKed unseen segment] 80  >  58846 [ACK] Seq=1 Ack=2 Win=501 Len=0 TSval=3864967684 TSecr=2574735016"
"143","7.170970753","2001:40a8:4400:3::5266:985a","2a0d:6fc2:4940:600:20c:29ff:fee3:884c","TCP","86","[TCP ACKed unseen segment] 80  >  58862 [ACK] Seq=1 Ack=2 Win=501 Len=0 TSval=3864967684 TSecr=2574735016"
"144","7.225066733","2a04:4e42:8e::760","2a0d:6fc2:4940:600:20c:29ff:fee3:884c","TCP","86","[TCP ACKed unseen segment] 443  >  50056 [ACK] Seq=1 Ack=2 Win=284 Len=0 TSval=1023986317 TSecr=2810389998"
"145","7.231620889","146.75.122.91","192.168.1.196","TCP","66","[TCP ACKed unseen segment] 443  >  33686 [ACK] Seq=1 Ack=2 Win=403 Len=0 TSval=3529906012 TSecr=3772671906"
"146","7.330874815","2600:1901:1:5a5::","2a0d:6fc2:4940:600:20c:29ff:fee3:884c","TLSv1.2","161","Application Data"
"147","7.330875188","2600:1901:1:5a5::","2a0d:6fc2:4940:600:20c:29ff:fee3:884c","TLSv1.2","180","Application Data"
"148","7.330875222","2600:1901:1:5a5::","2a0d:6fc2:4940:600:20c:29ff:fee3:884c","TLSv1.2","132","Application Data"
"149","7.331365857","2a0d:6fc2:4940:600:20c:29ff:fee3:884c","2600:1901:1:5a5::","TCP","86","54170  >  443 [ACK] Seq=7322 Ack=6184 Win=521 Len=0 TSval=1096307506 TSecr=2565763405"
"150","7.331571896","2a0d:6fc2:4940:600:20c:29ff:fee3:884c","2600:1901:1:5a5::","TLSv1.2","132","Application Data"
"151","7.334900514","2600:1901:1:5a5::","2a0d:6fc2:4940:600:20c:29ff:fee3:884c","TCP","86","443  >  54170 [ACK] Seq=6184 Ack=7368 Win=544 Len=0 TSval=2565763410 TSecr=1096307506"
"152","7.661061817","192.168.1.196","34.120.195.249","TLSv1.2","236","Application Data"
"153","7.661269944","192.168.1.196","34.120.195.249","TLSv1.2","244","Application Data"
"154","7.665251915","34.120.195.249","192.168.1.196","TCP","66","443  >  57680 [ACK] Seq=1 Ack=171 Win=1033 Len=0 TSval=126668839 TSecr=2803830866"
"155","7.665252334","34.120.195.249","192.168.1.196","TCP","66","443  >  57680 [ACK] Seq=1 Ack=349 Win=1033 Len=0 TSval=126668839 TSecr=2803830866"
"156","7.680200608","2a0d:6fc2:4940:600:20c:29ff:fee3:884c","2606:4700:4400::6812:26e9","TCP","86","36862  >  80 [ACK] Seq=1 Ack=1 Win=497 Len=0 TSval=1433175452 TSecr=3737403712"
"157","7.680419150","2a0d:6fc2:4940:600:20c:29ff:fee3:884c","2606:4700:4400::6812:26e9","TCP","86","36868  >  80 [ACK] Seq=1 Ack=1 Win=497 Len=0 TSval=1433175452 TSecr=3368220051"
"158","7.683858688","2606:4700:4400::6812:26e9","2a0d:6fc2:4940:600:20c:29ff:fee3:884c","TCP","86","[TCP ACKed unseen segment] 80  >  36862 [ACK] Seq=1 Ack=2 Win=9 Len=0 TSval=3737413952 TSecr=1433103963"
"159","7.683858827","2606:4700:4400::6812:26e9","2a0d:6fc2:4940:600:20c:29ff:fee3:884c","TCP","86","[TCP ACKed unseen segment] 80  >  36868 [ACK] Seq=1 Ack=2 Win=9 Len=0 TSval=3368230291 TSecr=1433103948"
"160","7.721064768","34.120.195.249","192.168.1.196","TLSv1.2","140","Application Data"
"161","7.721065156","34.120.195.249","192.168.1.196","TLSv1.2","106","Application Data"
"162","7.723178203","192.168.1.196","34.120.195.249","TCP","66","57680  >  443 [ACK] Seq=349 Ack=115 Win=579 Len=0 TSval=2803830928 TSecr=126668895"
"163","7.725978838","34.120.195.249","192.168.1.196","TLSv1.2","112","Application Data"
"164","7.726091603","192.168.1.196","34.120.195.249","TLSv1.2","112","Application Data"
"165","7.734186288","34.120.195.249","192.168.1.196","TCP","66","443  >  57680 [ACK] Seq=161 Ack=395 Win=1033 Len=0 TSval=126668904 TSecr=2803830931"
"166","8.048892836","192.168.1.149","224.0.0.22","IGMPv3","60","Membership Report / Join group 239.255.255.250 for any sources"
"167","8.192084474","2a0d:6fc2:4940:600:20c:29ff:fee3:884c","2a00:1450:4028:804::2003","TCP","86","36474  >  80 [ACK] Seq=1 Ack=1 Win=499 Len=0 TSval=2449272936 TSecr=2348007436"
"168","8.210242155","2a0d:6fc2:4940:600:20c:29ff:fee3:884c","2a00:1450:4028:804::2003","TCP","86","36484  >  80 [ACK] Seq=1 Ack=1 Win=508 Len=0 TSval=2449272954 TSecr=2348007436"
"169","8.210249249","192.168.1.196","2.17.190.73","TCP","66","54810  >  80 [ACK] Seq=1 Ack=1 Win=454 Len=0 TSval=1299617516 TSecr=4199562892"
"170","8.212327741","2a00:1450:4028:804::2003","2a0d:6fc2:4940:600:20c:29ff:fee3:884c","TCP","86","[TCP ACKed unseen segment] 80  >  36484 [ACK] Seq=1 Ack=2 Win=1050 Len=0 TSval=2348017694 TSecr=2449242391"
"171","8.212994339","2a00:1450:4028:804::2003","2a0d:6fc2:4940:600:20c:29ff:fee3:884c","TCP","86","[TCP ACKed unseen segment] 80  >  36474 [ACK] Seq=1 Ack=2 Win=1053 Len=0 TSval=2348017694 TSecr=2449191040"
"172","8.267422124","2.17.190.73","192.168.1.196","TCP","66","[TCP ACKed unseen segment] 80  >  54810 [ACK] Seq=1 Ack=2 Win=501 Len=0 TSval=4199573149 TSecr=1299586535"
"173","8.705190920","192.168.1.196","2.17.190.73","TCP","66","54814  >  80 [ACK] Seq=1 Ack=1 Win=472 Len=0 TSval=1299618011 TSecr=989269276"
"174","8.766007374","2.17.190.73","192.168.1.196","TCP","66","[TCP ACKed unseen segment] 80  >  54814 [ACK] Seq=1 Ack=2 Win=501 Len=0 TSval=989279517 TSecr=1299546542"
"175","9.216020625","2a0d:6fc2:4940:600:20c:29ff:fee3:884c","2a00:1450:4028:804::2003","TCP","86","54162  >  80 [ACK] Seq=1 Ack=1 Win=479 Len=0 TSval=2449273960 TSecr=2310335818"
"176","9.216146743","2a0d:6fc2:4940:600:20c:29ff:fee3:884c","2a04:4e42:8e::760","TCP","86","40138  >  443 [ACK] Seq=1 Ack=1 Win=5247 Len=0 TSval=2810432792 TSecr=1684494400"
"177","9.216173733","2a0d:6fc2:4940:600:20c:29ff:fee3:884c","2a04:4e42:8e::760","TCP","86","40134  >  443 [ACK] Seq=1 Ack=1 Win=618 Len=0 TSval=2810432792 TSecr=2906162359"
"178","9.216194607","2a0d:6fc2:4940:600:20c:29ff:fee3:884c","2a00:1450:4028:804::2003","TCP","86","36470  >  80 [ACK] Seq=1 Ack=1 Win=508 Len=0 TSval=2449273960 TSecr=2310335818"
"179","9.216214450","2a0d:6fc2:4940:600:20c:29ff:fee3:884c","2a04:4e42:200::603","TCP","86","46590  >  443 [ACK] Seq=1 Ack=1 Win=671 Len=0 TSval=3296667991 TSecr=3012646461"
"180","9.218371623","2a00:1450:4028:804::2003","2a0d:6fc2:4940:600:20c:29ff:fee3:884c","TCP","86","[TCP ACKed unseen segment] 80  >  36470 [ACK] Seq=1 Ack=2 Win=1050 Len=0 TSval=2310346057 TSecr=2449202362"
"181","9.219959137","2a00:1450:4028:804::2003","2a0d:6fc2:4940:600:20c:29ff:fee3:884c","TCP","86","[TCP ACKed unseen segment] 80  >  54162 [ACK] Seq=1 Ack=2 Win=1050 Len=0 TSval=2310346058 TSecr=2449202362"
"182","9.270854474","2a04:4e42:8e::760","2a0d:6fc2:4940:600:20c:29ff:fee3:884c","TCP","86","[TCP ACKed unseen segment] 443  >  40138 [ACK] Seq=1 Ack=2 Win=288 Len=0 TSval=1684504640 TSecr=2810351160"
"183","9.275523096","2a04:4e42:200::603","2a0d:6fc2:4940:600:20c:29ff:fee3:884c","TCP","86","[TCP ACKed unseen segment] 443  >  46590 [ACK] Seq=1 Ack=2 Win=284 Len=0 TSval=3012656700 TSecr=3296637309"
"184","9.280232668","2a04:4e42:8e::760","2a0d:6fc2:4940:600:20c:29ff:fee3:884c","TCP","86","[TCP ACKed unseen segment] 443  >  40134 [ACK] Seq=1 Ack=2 Win=284 Len=0 TSval=2906172599 TSecr=2810351047"
"185","10.014267501","192.168.1.189","224.0.0.251","MDNS","82","Standard query 0x0000 PTR _googlecast._tcp.local, ""QM"" question"
"186","10.014267287","22:b0:01:33:6b:ab","LLDP_Multicast","LLDP","60","MA/22:b0:01:33:6b:a3 MA/22:b0:01:33:6b:ab 180 "
"187","10.014267530","192.168.1.189","224.0.0.251","MDNS","409","Standard query response 0x0000 PTR PartnerTV-Box-a3b28eb995eb425748e09e22bf2b14b2._googlecast._tcp.local TXT, cache flush SRV, cache flush 0 0 8009 a3b28eb9-95eb-4257-48e0-9e22bf2b14b2.local A, cache flush 192.168.1.189"
"188","10.014267549","fe80::60fa:3ed:69c6:c408","ff02::fb","MDNS","102","Standard query 0x0000 PTR _googlecast._tcp.local, ""QM"" question"
"189","10.014267569","fe80::60fa:3ed:69c6:c408","ff02::fb","MDNS","441","Standard query response 0x0000 PTR PartnerTV-Box-a3b28eb995eb425748e09e22bf2b14b2._googlecast._tcp.local TXT, cache flush SRV, cache flush 0 0 8009 a3b28eb9-95eb-4257-48e0-9e22bf2b14b2.local AAAA, cache flush 2a0d:6fc2:4940:600:2469:a979:5284:81ad"
"190","10.240009818","192.168.1.196","151.101.194.91","TCP","66","[TCP Dup ACK 1#1] 47522  >  443 [ACK] Seq=1 Ack=1 Win=654 Len=0 TSval=2416783663 TSecr=891904019"
"191","10.298801158","151.101.194.91","192.168.1.196","TCP","66","[TCP Dup ACK 2#1] 443  >  47522 [ACK] Seq=1 Ack=2 Win=287 Len=0 TSval=891914259 TSecr=2416753204"
"192","10.752141678","2a0d:6fc2:4940:600:20c:29ff:fee3:884c","2001:40a8:4400:3::5266:982a","TCP","86","[TCP Dup ACK 3#1] 48670  >  80 [ACK] Seq=1 Ack=1 Win=486 Len=0 TSval=3896220448 TSecr=1904700431"
"193","10.755073181","2001:40a8:4400:3::5266:982a","2a0d:6fc2:4940:600:20c:29ff:fee3:884c","TCP","86","[TCP Dup ACK 4#1] 80  >  48670 [ACK] Seq=1 Ack=2 Win=501 Len=0 TSval=1904710671 TSecr=3896138586"
"194","12.174719200","fe80::22b0:1ff:fe33:6ba2","2a0d:6fc2:4940:600:20c:29ff:fee3:884c","ICMPv6","86","Neighbor Solicitation for 2a0d:6fc2:4940:600:20c:29ff:fee3:884c from 20:b0:01:33:6b:a2"
"195","12.174748447","2a0d:6fc2:4940:600:20c:29ff:fee3:884c","fe80::22b0:1ff:fe33:6ba2","ICMPv6","78","Neighbor Advertisement 2a0d:6fc2:4940:600:20c:29ff:fee3:884c (sol)"
"196","12.720953681","192.168.1.196","192.168.1.1","DNS","94","Standard query 0x8253 A api-partner.spotify.com OPT"
"197","12.722354834","192.168.1.196","192.168.1.1","DNS","94","Standard query 0xfb5a AAAA api-partner.spotify.com OPT"
"198","12.730558320","192.168.1.1","192.168.1.196","DNS","191","Standard query response 0x8253 A api-partner.spotify.com CNAME partners.wg.spotify.com CNAME edge-web.dual-gslb.spotify.com A 35.186.224.24 OPT"
"199","12.730559107","192.168.1.1","192.168.1.196","DNS","203","Standard query response 0xfb5a AAAA api-partner.spotify.com CNAME partners.wg.spotify.com CNAME edge-web.dual-gslb.spotify.com AAAA 2600:1901:1:7c5:: OPT"
"200","12.751209960","2a0d:6fc2:4940:600:20c:29ff:fee3:884c","2600:1901:1:7c5::","TLSv1.2","686","Application Data"
"201","12.751821278","2a0d:6fc2:4940:600:20c:29ff:fee3:884c","2600:1901:1:7c5::","TLSv1.2","691","Application Data"
"202","12.755898490","2600:1901:1:7c5::","2a0d:6fc2:4940:600:20c:29ff:fee3:884c","TCP","86","443  >  37026 [ACK] Seq=1 Ack=601 Win=849 Len=0 TSval=615994622 TSecr=1245617682"
"203","12.755898826","2600:1901:1:7c5::","2a0d:6fc2:4940:600:20c:29ff:fee3:884c","TCP","86","443  >  37026 [ACK] Seq=1 Ack=1206 Win=847 Len=0 TSval=615994622 TSecr=1245617682"
"204","12.763584135","2a0d:6fc2:4940:600:20c:29ff:fee3:884c","2600:1901:1:7c5::","TLSv1.2","742","Application Data"
"205","12.766739698","2600:1901:1:7c5::","2a0d:6fc2:4940:600:20c:29ff:fee3:884c","TCP","86","443  >  37026 [ACK] Seq=1 Ack=1862 Win=845 Len=0 TSval=615994634 TSecr=1245617694"
"206","12.827383359","2a0d:6fc2:4940:600:20c:29ff:fee3:884c","2600:1901:1:7c5::","TLSv1.2","589","Application Data"
"207","12.847006695","2600:1901:1:7c5::","2a0d:6fc2:4940:600:20c:29ff:fee3:884c","TCP","86","443  >  37106 [ACK] Seq=1 Ack=504 Win=1029 Len=0 TSval=3839049828 TSecr=1245617758"
"208","12.847006937","2600:1901:1:7c5::","2a0d:6fc2:4940:600:20c:29ff:fee3:884c","TLSv1.2","169","Application Data"
"209","12.847006953","2600:1901:1:7c5::","2a0d:6fc2:4940:600:20c:29ff:fee3:884c","TLSv1.2","516","Application Data"
"210","12.847006971","2600:1901:1:7c5::","2a0d:6fc2:4940:600:20c:29ff:fee3:884c","TLSv1.2","132","Application Data"
"211","12.850158420","2a0d:6fc2:4940:600:20c:29ff:fee3:884c","2600:1901:1:7c5::","TCP","86","37026  >  443 [ACK] Seq=1862 Ack=560 Win=2965 Len=0 TSval=1245617781 TSecr=615994713"
"212","12.850410420","2a0d:6fc2:4940:600:20c:29ff:fee3:884c","2600:1901:1:7c5::","TLSv1.2","132","Application Data"
"213","12.856989228","2600:1901:1:7c5::","2a0d:6fc2:4940:600:20c:29ff:fee3:884c","TCP","86","443  >  37026 [ACK] Seq=560 Ack=1908 Win=845 Len=0 TSval=615994721 TSecr=1245617781"
"214","12.863413346","2a0d:6fc2:4940:600:20c:29ff:fee3:884c","2600:1901:1:7c5::","TCP","1474","37126  >  443 [ACK] Seq=2567 Ack=1946 Win=502 Len=1388 TSval=1245617794 TSecr=1584507929 [TCP PDU reassembled in 215]"
"215","12.863418398","2a0d:6fc2:4940:600:20c:29ff:fee3:884c","2600:1901:1:7c5::","TLSv1.2","1218","Application Data"
"216","12.867013597","2600:1901:1:7c5::","2a0d:6fc2:4940:600:20c:29ff:fee3:884c","TCP","86","443  >  37126 [ACK] Seq=1946 Ack=3955 Win=968 Len=0 TSval=1584519718 TSecr=1245617794"
"217","12.867014011","2600:1901:1:7c5::","2a0d:6fc2:4940:600:20c:29ff:fee3:884c","TCP","86","443  >  37126 [ACK] Seq=1946 Ack=5087 Win=964 Len=0 TSval=1584519719 TSecr=1245617794"
"218","12.893755190","2600:1901:1:7c5::","2a0d:6fc2:4940:600:20c:29ff:fee3:884c","TLSv1.2","176","Application Data"
"219","12.894759596","2a0d:6fc2:4940:600:20c:29ff:fee3:884c","2600:1901:1:7c5::","TLSv1.2","132","Application Data"
"220","12.900400821","2600:1901:1:7c5::","2a0d:6fc2:4940:600:20c:29ff:fee3:884c","TCP","86","443  >  37106 [ACK] Seq=91 Ack=550 Win=1029 Len=0 TSval=3839049896 TSecr=1245617825"
"221","12.926590722","2600:1901:1:7c5::","2a0d:6fc2:4940:600:20c:29ff:fee3:884c","TLSv1.2","169","Application Data"
"222","12.926591157","2600:1901:1:7c5::","2a0d:6fc2:4940:600:20c:29ff:fee3:884c","TLSv1.2","705","Application Data"
"223","12.926591254","2600:1901:1:7c5::","2a0d:6fc2:4940:600:20c:29ff:fee3:884c","TLSv1.2","132","Application Data"
"224","12.927443781","2a0d:6fc2:4940:600:20c:29ff:fee3:884c","2600:1901:1:7c5::","TCP","86","37026  >  443 [ACK] Seq=1908 Ack=1308 Win=2984 Len=0 TSval=1245617858 TSecr=615994794"
"225","12.927673385","2a0d:6fc2:4940:600:20c:29ff:fee3:884c","2600:1901:1:7c5::","TLSv1.2","132","Application Data"
"226","12.937296269","2600:1901:1:7c5::","2a0d:6fc2:4940:600:20c:29ff:fee3:884c","TCP","86","443  >  37026 [ACK] Seq=1308 Ack=1954 Win=845 Len=0 TSval=615994798 TSecr=1245617858"
"227","12.954007107","2600:1901:1:7c5::","2a0d:6fc2:4940:600:20c:29ff:fee3:884c","TLSv1.2","174","Application Data"
"228","12.954007461","2600:1901:1:7c5::","2a0d:6fc2:4940:600:20c:29ff:fee3:884c","TLSv1.2","1294","Application Data"
"229","12.954007479","2600:1901:1:7c5::","2a0d:6fc2:4940:600:20c:29ff:fee3:884c","TLSv1.2","1294","Application Data"
"230","12.954007497","2600:1901:1:7c5::","2a0d:6fc2:4940:600:20c:29ff:fee3:884c","TLSv1.2","990","Application Data"
"231","12.954007515","2600:1901:1:7c5::","2a0d:6fc2:4940:600:20c:29ff:fee3:884c","TLSv1.2","1253","Application Data"
"232","12.954007533","2600:1901:1:7c5::","2a0d:6fc2:4940:600:20c:29ff:fee3:884c","TLSv1.2","132","Application Data"
"233","12.954033932","2a0d:6fc2:4940:600:20c:29ff:fee3:884c","2600:1901:1:7c5::","TCP","86","37026  >  443 [ACK] Seq=1954 Ack=2604 Win=3006 Len=0 TSval=1245617885 TSecr=615994810"
"234","12.954115432","2a0d:6fc2:4940:600:20c:29ff:fee3:884c","2600:1901:1:7c5::","TCP","86","37026  >  443 [ACK] Seq=1954 Ack=4716 Win=3046 Len=0 TSval=1245617885 TSecr=615994810"
"235","12.954141371","2a0d:6fc2:4940:600:20c:29ff:fee3:884c","2600:1901:1:7c5::","TCP","86","37026  >  443 [ACK] Seq=1954 Ack=5929 Win=3068 Len=0 TSval=1245617885 TSecr=615994810"
"236","12.955571644","2a0d:6fc2:4940:600:20c:29ff:fee3:884c","2600:1901:1:7c5::","TLSv1.2","132","Application Data"
"237","12.957121127","2600:1901:1:7c5::","2a0d:6fc2:4940:600:20c:29ff:fee3:884c","TLSv1.2","178","Application Data"
"238","12.957121781","2600:1901:1:7c5::","2a0d:6fc2:4940:600:20c:29ff:fee3:884c","TLSv1.2","1294","Application Data"
"239","12.957121800","2600:1901:1:7c5::","2a0d:6fc2:4940:600:20c:29ff:fee3:884c","TLSv1.2","802","Application Data"
"240","12.957121819","2600:1901:1:7c5::","2a0d:6fc2:4940:600:20c:29ff:fee3:884c","TLSv1.2","132","Application Data"
"241","12.958325810","2a0d:6fc2:4940:600:20c:29ff:fee3:884c","2600:1901:1:7c5::","TCP","86","37126  >  443 [ACK] Seq=5087 Ack=4008 Win=488 Len=0 TSval=1245617889 TSecr=1584519808"
"242","12.959172577","2a0d:6fc2:4940:600:20c:29ff:fee3:884c","2600:1901:1:7c5::","TLSv1.2","132","Application Data"
"243","12.965357783","2600:1901:1:7c5::","2a0d:6fc2:4940:600:20c:29ff:fee3:884c","TCP","86","443  >  37126 [ACK] Seq=4008 Ack=5133 Win=964 Len=0 TSval=1584519815 TSecr=1245617890"
"244","12.965358085","2600:1901:1:7c5::","2a0d:6fc2:4940:600:20c:29ff:fee3:884c","TCP","86","443  >  37026 [ACK] Seq=5929 Ack=2000 Win=845 Len=0 TSval=615994831 TSecr=1245617886"
"245","12.969157554","2a0d:6fc2:4940:600:20c:29ff:fee3:884c","2001:40a8:4400:3::5266:982a","TLSv1.2","707","[TCP Previous segment not captured] , Application Data"
"246","12.970740567","2a0d:6fc2:4940:600:20c:29ff:fee3:884c","2001:40a8:4400:3::5266:982a","TCP","94","55536  >  443 [SYN] Seq=0 Win=64400 Len=0 MSS=1400 SACK_PERM TSval=3896222666 TSecr=0 WS=128"
"247","12.977540473","2001:40a8:4400:3::5266:982a","2a0d:6fc2:4940:600:20c:29ff:fee3:884c","TLSv1.2","674","Application Data"
"248","12.977540823","2001:40a8:4400:3::5266:982a","2a0d:6fc2:4940:600:20c:29ff:fee3:884c","TCP","94","443  >  55536 [SYN, ACK] Seq=0 Ack=1 Win=64260 Len=0 MSS=1344 SACK_PERM TSval=1904712889 TSecr=3896222666 WS=128"
"249","12.977540840","2001:40a8:4400:3::5266:982a","2a0d:6fc2:4940:600:20c:29ff:fee3:884c","TLSv1.2","16499","Application Data"
"250","12.977578363","2a0d:6fc2:4940:600:20c:29ff:fee3:884c","2001:40a8:4400:3::5266:982a","TCP","86","55536  >  443 [ACK] Seq=1 Ack=1 Win=64512 Len=0 TSval=3896222673 TSecr=1904712889"
"251","12.977677190","2a0d:6fc2:4940:600:20c:29ff:fee3:884c","2001:40a8:4400:3::5266:982a","TCP","86","51538  >  443 [ACK] Seq=623 Ack=17002 Win=3835 Len=0 TSval=3896222673 TSecr=1904712889"
"252","12.977723849","2001:40a8:4400:3::5266:982a","2a0d:6fc2:4940:600:20c:29ff:fee3:884c","TCP","11190","443  >  51538 [ACK] Seq=17002 Ack=623 Win=501 Len=11104 TSval=1904712890 TSecr=3896222665 [TCP PDU reassembled in 255]"
"253","12.977728198","2a0d:6fc2:4940:600:20c:29ff:fee3:884c","2001:40a8:4400:3::5266:982a","TCP","86","51538  >  443 [ACK] Seq=623 Ack=28106 Win=4008 Len=0 TSval=3896222673 TSecr=1904712890"
"254","12.978220602","2a0d:6fc2:4940:600:20c:29ff:fee3:884c","2001:40a8:4400:3::5266:982a","TLSv1.2","603","Client Hello (SNI=audio-ak.spotifycdn.com)"
"255","12.981414732","2001:40a8:4400:3::5266:982a","2a0d:6fc2:4940:600:20c:29ff:fee3:884c","TLSv1.2","12459","Application Data, Application Data"
"256","12.981441268","2a0d:6fc2:4940:600:20c:29ff:fee3:884c","2001:40a8:4400:3::5266:982a","TCP","86","51538  >  443 [ACK] Seq=623 Ack=40479 Win=4201 Len=0 TSval=3896222677 TSecr=1904712890"
"257","12.981556214","2001:40a8:4400:3::5266:982a","2a0d:6fc2:4940:600:20c:29ff:fee3:884c","TLSv1.2","32912","Application Data, Application Data"
"258","12.981566384","2a0d:6fc2:4940:600:20c:29ff:fee3:884c","2001:40a8:4400:3::5266:982a","TCP","86","51538  >  443 [ACK] Seq=623 Ack=73305 Win=4714 Len=0 TSval=3896222677 TSecr=1904712891"
"259","12.981619767","2001:40a8:4400:3::5266:982a","2a0d:6fc2:4940:600:20c:29ff:fee3:884c","TLSv1.2","54218","Application Data, Application Data, Application Data, Application Data"
